Symbol,Name,Market Cap,Country,IPO Year,Sector,Industry
IONS,Ionis Pharmaceuticals Inc. Common Stock,3726532296,United States,,Health Care,Biotechnology: Pharmaceutical Preparations
IOR,Income Opportunity Realty Investors Inc. Common Stock,51503673,United States,,Finance,Diversified Financial Services
IOSP,Innospec Inc. Common Stock,2050912900,United States,,Basic Industries,Industrial Specialties
IOVA,Iovance Biotherapeutics Inc. Common Stock,2596680403,United States,,Health Care,Biotechnology: Pharmaceutical Preparations
IP,International Paper Company Common Stock,17988374200,United States,,Basic Industries,Containers/Packaging
IPA,ImmunoPrecise Antibodies Ltd. Common Stock,104817073,Canada,,,
IPAR,Inter Parfums Inc. Common Stock,2873185495,United States,,Consumer Non-Durables,Package Goods/Cosmetics
IPAX,Inflection Point Acquisition Corp. Class A Ordinary Share,319841013,United States,2021,,
IPAXU,Inflection Point Acquisition Corp. Units,0,United States,2021,,
IPAXW,Inflection Point Acquisition Corp. Warrants,0,United States,2021,,
IPDN,Professional Diversity Network Inc. Common Stock,15255856,United States,2013,Technology,EDP Services
IPG,Interpublic Group of Companies Inc. (The) Common Stock,13553056049,United States,,Technology,Advertising
IPGP,IPG Photonics Corporation Common Stock,8771439166,United States,2006,Technology,Semiconductors
IPHA,Innate Pharma S.A. ADS,344209423,France,2019,Health Care,Biotechnology: Pharmaceutical Preparations
IPI,Intrepid Potash Inc Common Stock,529926214,United States,2008,Basic Industries,Major Chemicals
IPLDP,Interstate Power & Light Company Perp Prd Ser D,0,United States,,Public Utilities,Power Generation
IPOD,Social Capital Hedosophia Holdings Corp. IV Class A Ordinary Shares,584775000,United States,2020,Finance,Business Services
IPOF,Social Capital Hedosophia Holdings Corp. VI Class A Ordinary Shares,1484937500,United States,2020,Finance,Business Services
IPSC,Century Therapeutics Inc. Common Stock,832188217,United States,2021,Consumer Durables,Specialty Chemicals
IPVA,InterPrivate II Acquisition Corp. Class A Common Stock,316976125,,2021,,
IPVF,InterPrivate III Financial Partners Inc. Class A Common Stock,330035963,,2021,,
IPVI,InterPrivate IV InfraTech Partners Inc. Class A Common Stock,349312500,United States,2021,,
IPVIU,InterPrivate IV InfraTech Partners Inc. Units,0,United States,2021,,
IPVIW,InterPrivate IV InfraTech Partners Inc. Warrant,0,United States,2021,,
IPW,iPower Inc. Common Stock,65438157,United States,2021,Consumer Services,Catalog/Specialty Distribution
IPWR,Ideal Power Inc. Common Stock,64517904,United States,2013,Capital Goods,Industrial Machinery/Components
IQ,iQIYI Inc. American Depositary Shares,3717531917,China,2018,Technology,Internet and Information Services
IQI,Invesco Quality Municipal Income Trust Common Stock,693835417,United States,,Finance,Finance Companies
IQMDU,Intelligent Medicine Acquisition Corp. Unit,0,United States,2021,,
IQV,IQVIA Holdings Inc. Common Stock,49991216622,United States,2013,Health Care,Managed Health Care
IR,Ingersoll Rand Inc. Common Stock,23843700563,United States,2017,Capital Goods,Industrial Machinery/Components
IRBT,iRobot Corporation Common Stock,1950162409,United States,2005,,
IRCP,IRSA Propiedades Comerciales S.A. American Depositary Shares,286851908,Argentina,,Consumer Services,Building operators
IRDM,Iridium Communications Inc Common Stock,5145317097,United States,,Consumer Services,Telecommunications Equipment
IREN,Iris Energy Limited Ordinary Shares,849207146,Australia,2021,,
IRIX,IRIDEX Corporation Common Stock,94401117,United States,1996,Health Care,Biotechnology: Electromedical & Electrotherapeutic Apparatus
IRL,New Ireland Fund Inc (The) Common Stock,58675212,United States,1990,Finance,Trusts Except Educational Religious and Charitable
IRM,Iron Mountain Incorporated (Delaware)Common Stock REIT,13634885861,United States,,Consumer Services,Real Estate Investment Trusts
IRMD,iRadimed Corporation Common Stock,548097118,United States,2014,Health Care,Medical/Dental Instruments
IRNT,IronNet Inc. Common Stock,627267103,United States,2020,Technology,EDP Services
IROQ,IF Bancorp Inc. Common Stock,76954167,United States,2011,Finance,Finance: Consumer Services
IRS,IRSA Inversiones Y Representaciones S.A. Common Stock,303005312,Argentina,,Consumer Services,Homebuilding
IRT,Independence Realty Trust Inc. Common Stock,2604673948,United States,2013,Consumer Services,Real Estate Investment Trusts
IRTC,iRhythm Technologies Inc. Common Stock,2885503460,United States,2016,Health Care,Medical/Dental Instruments
IRWD,Ironwood Pharmaceuticals Inc. Class A Common Stock,1796882347,United States,2010,Health Care,Biotechnology: Pharmaceutical Preparations
IS,ironSource Ltd. Class A Ordinary Shares,8091403137,,2021,,
ISAA,Iron Spark I Inc. Class A Common Stock,221289632,United States,2021,,
ISBC,Investors Bancorp Inc. Common Stock,3664166816,United States,,Finance,Savings Institutions
ISD,PGIM High Yield Bond Fund Inc.,519802596,United States,2012,Finance,Trusts Except Educational Religious and Charitable
ISDR,Issuer Direct Corporation Common Stock,111418607,United States,,Technology,EDP Services
ISEE,IVERIC bio Inc. Common Stock,1616442034,United States,2013,Health Care,Biotechnology: Pharmaceutical Preparations
ISIG,Insignia Systems Inc. Common Stock,8734483,United States,1991,Technology,Advertising
ISLE,Isleworth Healthcare Acquisition Corporation Common stock,257459988,United States,2021,,
ISLEW,Isleworth Healthcare Acquisition Corporation Warrant,0,United States,2021,,
ISO,IsoPlexis Corporation Common Stock,403962800,United States,2021,Health Care,Biotechnology: Electromedical & Electrotherapeutic Apparatus
ISOS,Isos Acquisition Corporation Class A Ordinary Shares,318227704,,2021,,
ISPC,iSpecimen Inc. Common Stock,92226636,United States,2021,Health Care,Precision Instruments
ISR,IsoRay Inc. Common Stock (DE),59604412,United States,,Health Care,Medical/Dental Instruments
ISRG,Intuitive Surgical Inc. Common Stock,1.14898E+11,United States,2000,Health Care,Medical/Dental Instruments
ISSC,Innovative Solutions and Support Inc. Common Stock,113826055,United States,2000,Capital Goods,Military/Government/Technical
ISTR,Investar Holding Corporation Common Stock,184838238,United States,2014,Finance,Commercial Banks
ISUN,iSun Inc. Common Stock,71054561,United States,2016,Technology,Semiconductors
IT,Gartner Inc. Common Stock,25444749694,United States,1993,Finance,Diversified Commercial Services
ITCB,Itau CorpBanca American Depositary Shares (each representing 1500 shares of Common Stock no par value),1062390014,Chile,,Finance,Commercial Banks
ITCI,Intra-Cellular Therapies Inc. Common Stock,2957930716,United States,,Health Care,Biotechnology: Pharmaceutical Preparations
ITGR,Integer Holdings Corporation Common Stock,2649103699,United States,,Health Care,Medical/Dental Instruments
ITHX,ITHAX Acquisition Corp. Class A Ordinary Shares,300909375,United States,2021,Finance,Business Services
ITHXU,ITHAX Acquisition Corp. Unit,0,United States,2021,Finance,Business Services
ITHXW,ITHAX Acquisition Corp. Warrant,0,United States,2021,Finance,Business Services
ITI,Iteris Inc. Common Stock,187529750,United States,,Capital Goods,Telecommunications Equipment
ITIC,Investors Title Company Common Stock,377119690,United States,,Finance,Specialty Insurers
ITMR,Itamar Medical Ltd. American Depository Shares,503301872,Israel,,Health Care,Medical/Dental Instruments
ITOS,iTeos Therapeutics Inc. Common Stock,1228236954,United States,2020,Consumer Durables,Specialty Chemicals
ITP,IT Tech Packaging Inc. Common Stock,25010100,China,,Basic Industries,Paper
ITQ,Itiquira Acquisition Corp. Class A Ordinary Shares,280887500,United States,2021,Finance,Business Services
ITQRU,Itiquira Acquisition Corp. Unit,0,United States,2021,Finance,Business Services
ITQRW,Itiquira Acquisition Corp. Warrant,0,United States,2021,Finance,Business Services
ITRG,Integra Resources Corp. Common Shares,139120363,,,,
ITRI,Itron Inc. Common Stock,2767945426,United States,1993,Capital Goods,Electrical Products
ITRM,Iterum Therapeutics plc Ordinary Share,78593371,Ireland,2018,Health Care,Biotechnology: Pharmaceutical Preparations
ITRN,Ituran Location and Control Ltd. Ordinary Shares,523597917,Israel,2005,Technology,Electronic Components
ITT,ITT Inc. Common Stock ,8197056000,United States,2011,Capital Goods,Fluid Controls
ITUB,Itau Unibanco Banco Holding SA American Depositary Shares (Each repstg 500 Preferred shares),38923950861,Brazil,,Finance,Commercial Banks
ITW,Illinois Tool Works Inc. Common Stock,74050740642,United States,,Capital Goods,Industrial Machinery/Components
IVA,Inventiva S.A. American Depository Shares,570601443,France,2020,Consumer Services,Other Consumer Services
IVAC,Intevac Inc. Common Stock,113118158,United States,1995,,
IVAN,Ivanhoe Capital Acquisition Corp. Class A Ordinary Shares,348795000,,2021,Finance,Business Services
IVC,Invacare Corporation Common Stock,84397434,United States,,Health Care,Industrial Specialties
IVH,Delaware Ivy High Income Opportunities Fund,223698159,,2013,Finance,Investment Managers
IVR,INVESCO MORTGAGE CAPITAL INC Common Stock,922752650,United States,2009,Consumer Services,Real Estate Investment Trusts
IVR^B,Invesco Mortgage Capital Inc. Preferred Series B Cum Fxd to Fltg,,United States,,,
IVR^C,INVESCO MORTGAGE CAPITAL INC 7.5% Fixed-to-Floating Series C Cumulative Redeemable Preferred Stock Liquation Preference $25.00 per Share,,United States,,,
IVT,InvenTrust Properties Corp. Common Stock,1740203461,,2021,Consumer Services,Real Estate Investment Trusts
IVZ,Invesco Ltd Common Stock,10344862176,United States,,Finance,Investment Managers
IX,Orix Corp Ads Common Stock,24166780146,Japan,,Finance,Diversified Financial Services
IXAQ,IX Acquisition Corp. Class A Ordinary Share,284625000,United Kingdom,2021,,
IXAQU,IX Acquisition Corp. Unit,0,United Kingdom,2021,,
IXAQW,IX Acquisition Corp. Warrant,0,United Kingdom,2021,,
IZEA,IZEA Worldwide Inc. Common Stock,88660000,United States,,Technology,Advertising
J,Jacobs Engineering Group Inc. Common Stock,18296528915,United States,,Capital Goods,Oilfield Services/Equipment
JACK,Jack In The Box Inc. Common Stock,1765122324,United States,,Consumer Services,Restaurants
JAGX,Jaguar Health Inc. Common Stock,54389681,United States,2015,Health Care,Biotechnology: Pharmaceutical Preparations
JAKK,JAKKS Pacific Inc. Common Stock,87907699,United States,1996,Consumer Non-Durables,Recreational Products/Toys
JAMF,Jamf Holding Corp. Common Stock,3577304504,United States,2020,Technology,Computer Software: Prepackaged Software
JAN,JanOne Inc. Common Stock (NV),13090908,United States,,Public Utilities,Environmental Services
JANX,Janux Therapeutics Inc. Common Stock,667448620,United States,2021,Health Care,Biotechnology: Pharmaceutical Preparations
JAQC,Jupiter Acquisition Corporation Common stock,196886225,United States,2021,,
JAQCW,Jupiter Acquisition Corporation Warrants,0,United States,2021,,
JATT,JATT Acquisition Corp Class A Ordinary Shares,170430000,,2021,,
JAZZ,Jazz Pharmaceuticals plc Common Stock (Ireland),7392339508,Ireland,2007,Health Care,Biotechnology: Pharmaceutical Preparations
JBGS,JBG SMITH Properties Common Shares ,3602471276,United States,2017,Consumer Services,Real Estate Investment Trusts
JBHT,J.B. Hunt Transport Services Inc. Common Stock,20133263566,United States,,Transportation,Trucking Freight/Courier Services
JBI,Janus International Group Inc. Common Stock,1779259244,,2021,,
JBK,Lehman ABS 3.50 3.50% Adjustable Corp Backed Tr Certs GS Cap I,0,United States,,Finance,Trusts Except Educational Religious and Charitable
JBL,Jabil Inc. Common Stock,8455330293,United States,1993,Technology,Electrical Products
JBLU,JetBlue Airways Corporation Common Stock,4325215072,United States,2002,Transportation,Air Freight/Delivery Services
JBSS,John B. Sanfilippo & Son Inc. Common Stock,953115949,United States,1991,Consumer Non-Durables,Specialty Foods
JBT,John Bean Technologies Corporation Common Stock,5005386090,United States,,Capital Goods,Diversified Manufacture
JCE,Nuveen Core Equity Alpha Fund Nuveen Core Equity Alpha Fund Common Shares of Beneficial Interest,266727236,United States,2007,Finance,Trusts Except Educational Religious and Charitable
JCI,Johnson Controls International plc Ordinary Share,54902710190,Switzerland,,Capital Goods,Auto Parts:O.E.M.
JCIC,Jack Creek Investment Corp. Class A Ordinary Shares,420468750,United States,2021,Finance,Business Services
JCICU,Jack Creek Investment Corp. Units,0,United States,2021,Finance,Business Services
JCICW,Jack Creek Investment Corp. Warrants,0,United States,2021,Finance,Business Services
JCO,Nuveen Credit Opportunities 2022 Target Term Fund Common Shares of Beneficial Interest,225445450,United States,2017,Finance,Trusts Except Educational Religious and Charitable
JCS,Communications Systems Inc. Common Stock,27898199,United States,,Public Utilities,Telecommunications Equipment
JCTCF,Jewett-Cameron Trading Company Common Shares,31540363,United States,,,
JD,JD.com Inc. American Depositary Shares,1.21077E+11,China,2014,Miscellaneous,Business Services
JEF,Jefferies Financial Group Inc. Common Stock,9358335350,United States,,Finance,Finance/Investors Services
JELD,JELD-WEN Holding Inc. Common Stock,2320833843,United States,2017,,
JEMD,Nuveen Emerging Markets Debt 2022 Target Term Fund Common Shares of Beneficial Interest $0.01 par value per share,107576069,,2017,Finance,Investment Managers
JEQ,Aberdeen Japan Equity Fund Inc.  Common Stock,117726946,United States,1992,Finance,Finance Companies
JFIN,Jiayin Group Inc. American Depositary Shares,144787000,China,2019,Finance,Finance: Consumer Services
JFR,Nuveen Floating Rate Income Fund Common Stock,576584081,United States,2004,Finance,Trusts Except Educational Religious and Charitable
JFU,9F Inc. American Depositary Shares,380064042,China,2019,Finance,Finance: Consumer Services
JG,Aurora Mobile Limited American Depositary Shares,124347046,China,2018,Technology,EDP Services
JGH,Nuveen Global High Income Fund Common Shares of Beneficial Interest,355541209,United States,2014,Finance,Investment Managers
JHAA,Nuveen Corporate Income 2023 Target Term Fund,77865224,,2018,Finance,Finance/Investors Services
JHG,Janus Henderson Group plc Ordinary Shares,6917202692,,2017,Finance,Investment Managers
JHI,John Hancock Investors Trust Common Stock,164040351,United States,,Finance,Trusts Except Educational Religious and Charitable
JHS,John Hancock Income Securities Trust Common Stock,181570260,United States,,Finance,Finance Companies
JHX,James Hardie Industries plc American Depositary Shares (Ireland),17475704080,Ireland,,Capital Goods,Building Materials
JILL,J. Jill Inc. Common Stock,149768940,,2017,Consumer Services,Clothing/Shoe/Accessory Stores
JJSF,J & J Snack Foods Corp. Common Stock,2657719446,United States,1986,Consumer Non-Durables,Specialty Foods
JKHY,Jack Henry & Associates Inc. Common Stock,11403799749,United States,1985,Technology,Retail: Computer Software & Peripheral Equipment
JKS,JinkoSolar Holding Company Limited American Depositary Shares (each representing 4 Common Shares),2078205038,China,2010,Technology,Semiconductors
JLL,Jones Lang LaSalle Incorporated Common Stock,12135128944,United States,,Finance,Real Estate
JLS,Nuveen Mortgage and Income Fund,114413124,United States,2009,Finance,Investment Managers
JMAC,Maxpro Capital Acquisition Corp. Class A Common Stock,135783698,Taiwan,2021,,
JMACU,Maxpro Capital Acquisition Corp. Units,0,Taiwan,2021,,
JMACW,Maxpro Capital Acquisition Corp. Warrants,0,Taiwan,2021,,
JMIA,Jumia Technologies AG American Depositary Shares each representing two Ordinary Shares,1059870278,,2019,Consumer Services,Catalog/Specialty Distribution
JMM,Nuveen Multi-Market Income Fund (MA),70683755,United States,,Finance,Trusts Except Educational Religious and Charitable
JMPNZ,JMP Group LLC 6.875% Senior Notes due 2029,0,United States,,Finance,Investment Bankers/Brokers/Service
JNCE,Jounce Therapeutics Inc. Common Stock,365366790,United States,2017,Health Care,Biotechnology: Pharmaceutical Preparations
JNJ,Johnson & Johnson Common Stock,4.19583E+11,United States,,Health Care,Biotechnology: Pharmaceutical Preparations
JNPR,Juniper Networks Inc. Common Stock,10168413404,United States,1999,Technology,Computer peripheral equipment
JOAN,JOANN Inc. Common Stock,419490995,United States,2021,Consumer Non-Durables,Department/Specialty Retail Stores
JOB,GEE Group Inc. Common Stock,48492693,United States,,Technology,Diversified Commercial Services
JOBS,51job Inc. American Depositary Shares,3776483704,China,2004,Technology,Diversified Commercial Services
JOBY,Joby Aviation Inc. Common Stock,4263494422,United States,2020,Transportation,Aerospace
JOE,St. Joe Company (The) Common Stock,2815763493,United States,,Consumer Services,Homebuilding
JOF,Japan Smaller Capitalization Fund Inc Common Stock,229221194,United States,1990,Finance,Trusts Except Educational Religious and Charitable
JOFF,JOFF Fintech Acquisition Corp. Class A Common Stock,504045000,United States,2021,,
JOFFU,JOFF Fintech Acquisition Corp. Unit,0,United States,2021,,
JOFFW,JOFF Fintech Acquisition Corp. Warrant,0,United States,2021,,
JOUT,Johnson Outdoors Inc. Class A Common Stock,988313448,United States,,Consumer Non-Durables,Recreational Products/Toys
JP,Jupai Holdings Limited American Depositary Shares each representing six ordinary shares,33221851,,2015,Consumer Services,Other Consumer Services
JPC,Nuveen Preferred & Income Opportunities Fund,961602459,United States,2003,Finance,Investment Managers
JPI,Nuveen Preferred and Income Term Fund Common Shares of Beneficial Interest,558228769,,2012,Finance,Finance Companies
JPM,JP Morgan Chase & Co. Common Stock,4.67794E+11,United States,,Finance,Major Banks
JPM^C,J P Morgan Chase & Co Depositary Shares each representing a 1/400th interest in a share of 6.00% Non-Cumulative  Preferred Stock Series EE,,United States,,,
JPM^D,J P Morgan Chase & Co Depositary Shares each representing a 1/400th  interest in a share of 5.75% Non-Cumulative  Preferred Stock Series DD,,United States,,,
JPM^J,J P Morgan Chase & Co Depositary Shares each representing a 1/400th interest in a share of JPMorgan Chase & Co. 4.75% Non-Cumulative Preferred Stock Series GG,,United States,,,
JPM^K,J P Morgan Chase & Co Depositary Shares each representing a 1/400th interest in a share of 4.55% Non-Cumulative Preferred Stock Series JJ,,United States,,,
JPM^L,J P Morgan Chase & Co Depositary Shares each representing a 1/400th interest in a share of 4.625% Non-Cumulative Preferred Stock Series LL,,United States,,,
JPM^M,J P Morgan Chase & Co Depositary Shares each representing a 1/400th interest in a share of 4.20% Non-Cumulative Preferred Stock Series MM,,United States,,,
JPS,Nuveen Preferred & Income Securities Fund,1916558795,United States,2002,Finance,Investment Managers
JPT,Nuveen Preferred and Income 2022 Term Fund Common Shares of Beneficial Interest,166363656,United States,2017,Finance,Trusts Except Educational Religious and Charitable
JQC,Nuveen Credit Strategies Income Fund Shares of Beneficial Interest,870611642,United States,2003,Finance,Finance Companies
JRI,Nuveen Real Asset Income and Growth Fund Common Shares of Beneficial Interest,412628810,United States,2012,Finance,Finance Companies
JRJC,China Finance Online Co. Limited American Depositary Shares,15482026,China,2004,Finance,Investment Bankers/Brokers/Service
JRO,Nuveen Floating Rate Income Opportuntiy Fund Shares of Beneficial Interest,404195943,United States,2004,Finance,Investment Managers
JRS,Nuveen Real Estate Income Fund Common Shares of Beneficial Interest,338619760,United States,2001,Finance,Finance/Investors Services
JRSH,Jerash Holdings (US) Inc. Common Stock,83626676,United States,2018,Basic Industries,Industrial Specialties
JRVR,James River Group Holdings Ltd. Common Shares,924820495,Bermuda,2014,Finance,Property-Casualty Insurers
JSD,Nuveen Short Duration Credit Opportunities Fund Common Shares of Beneficial Interest,147855600,United States,2011,Finance,Finance Companies
JSM,Navient Corporation 6% Senior Notes due December 15 2043,0,United States,,Finance,Finance: Consumer Services
JSPR,Jasper Therapeutics Inc. Common Stock,299040564,United States,2020,Health Care,Biotechnology: Pharmaceutical Preparations
JSPRW,Japer Therapeutics Inc. Warrants,0,United States,2020,Health Care,Biotechnology: Pharmaceutical Preparations
JT,Jianpu Technology Inc. American depositary shares,16099962,,2017,Technology,EDP Services
JUGG,Jaws Juggernaut Acquisition Corporation Class A Ordinary Share,339480000,United States,2021,,
JUGGU,Jaws Juggernaut Acquisition Corporation Unit,0,United States,2021,,
JUGGW,Jaws Juggernaut Acquisition Corporation Warrant,0,United States,2021,,
JUPW,Jupiter Wellness Inc. Common Stock,30837301,United States,2020,Health Care,Biotechnology: Pharmaceutical Preparations
JUPWW,Jupiter Wellness Inc. Warrant,0,United States,2020,Health Care,Biotechnology: Pharmaceutical Preparations
JVA,Coffee Holding Co. Inc. Common Stock,23919030,United States,2005,Consumer Non-Durables,Specialty Foods
JW/A,John Wiley & Sons Inc.,,United States,,,
JW/B,John Wiley & Sons Inc.,,United States,,,
JWEL,Jowell Global Ltd. Ordinary Shares,347422449,China,2021,Consumer Services,Other Consumer Services
JWN,Nordstrom Inc. Common Stock,3216267000,United States,,Consumer Services,Clothing/Shoe/Accessory Stores
JWSM,Jaws Mustang Acquisition Corp. Class A Ordinary Shares,1267875000,,2021,Finance,Business Services
JXN,Jackson Financial Inc. Class A Common Stock ,3225957313,,2021,Finance,Finance/Investors Services
JYAC,Jiya Acquisition Corp. Class A Common Stock,131754598,United States,2020,,
JYNT,The Joint Corp. Common Stock,1031995072,United States,2014,,
JZXN,Jiuzi Holdings Inc. Ordinary Shares,32783071,China,2021,Consumer Durables,Automotive Aftermarket
K,Kellogg Company Common Stock,21490736589,United States,,Consumer Non-Durables,Packaged Foods
KAHC,KKR Acquisition Holdings I Corp. Class A Common Stock,1697400000,,2021,,
KAI,Kadant Inc Common Stock,2672995682,United States,,Technology,Industrial Machinery/Components
KAII,Kismet Acquisition Two Corp. Class A Ordinary Shares,285480000,United States,2021,Finance,Business Services
KAIIU,Kismet Acquisition Two Corp. Unit,0,United States,2021,Finance,Business Services
KAIIW,Kismet Acquisition Two Corp. Warrant,0,United States,2021,Finance,Business Services
KAIR,Kairos Acquisition Corp. Class A Ordinary Shares,337065000,United States,2021,Finance,Business Services
KAIRU,Kairos Acquisition Corp. Unit,0,United States,2021,Finance,Business Services
KAIRW,Kairos Acquisition Corp. Warrant,0,United States,2021,Finance,Business Services
KALA,Kala Pharmaceuticals Inc. Common Stock,96422968,United States,2017,Health Care,Biotechnology: Pharmaceutical Preparations
KALU,Kaiser Aluminum Corporation Common Stock,1479035537,United States,,Basic Industries,Aluminum
KALV,KalVista Pharmaceuticals Inc. Common Stock,302052024,United Kingdom,2015,Health Care,Biotechnology: Pharmaceutical Preparations
KAMN,Kaman Corporation Common Stock,1119579367,United States,,Capital Goods,Military/Government/Technical
KAR,KAR Auction Services Inc Common Stock,2014797855,United States,2009,,
KARO,Karooooo Ltd. Ordinary Shares,1005910945,Singapore,2021,Technology,Computer Software: Prepackaged Software
KAVL,Kaival Brands Innovations Group Inc. Common Stock,29178033,United States,,Consumer Non-Durables,Farming/Seeds/Milling
KB,KB Financial Group Inc,18620624870,South Korea,,Finance,Commercial Banks
KBAL,Kimball International Inc. Class B Common Stock,372240577,United States,,Consumer Durables,Industrial Specialties
KBH,KB Home Common Stock,3692430889,United States,1986,,
KBNT,Kubient Inc. Common Stock,34777042,United States,2020,Technology,EDP Services
KBNTW,Kubient Inc. Warrant,0,United States,2020,Technology,EDP Services
KBR,KBR Inc. Common Stock,6050505765,United States,2006,Capital Goods,Oilfield Services/Equipment
KC,Kingsoft Cloud Holdings Limited American Depositary Shares,3494535663,China,2020,Technology,Computer Software: Prepackaged Software
KCGI,Kensington Capital Acquisition Corp. V Class A Ordinary Shares,339480000,,2021,,
KD,Kyndryl Holdings Inc. Common Stock,4175654444,,2021,Technology,EDP Services
KDNY,Chinook Therapeutics Inc. Common Stock,827906808,United States,2015,Health Care,Biotechnology: Pharmaceutical Preparations
KDP,Keurig Dr Pepper Inc. Common Stock,48877136145,United States,,Consumer Non-Durables,Beverages (Production/Distribution)
KE,Kimball Electronics Inc. Common Stock,514066657,United States,,Capital Goods,Industrial Machinery/Components
KELYA,Kelly Services Inc. Class A Common Stock,653864704,United States,,Technology,Diversified Commercial Services
KELYB,Kelly Services Inc. Class B Common Stock,660170953,United States,,Technology,Diversified Commercial Services
KEN,Kenon Holdings Ltd. Ordinary Shares,2337976524,Singapore,2015,Public Utilities,Electric Utilities: Central
KEP,Korea Electric Power Corporation Common Stock,11593871231,South Korea,1994,Public Utilities,Electric Utilities: Central
KEQU,Kewaunee Scientific Corporation Common Stock,35849868,United States,,Capital Goods,Medical Specialities
KERN,Akerna Corp. Common Stock,31772678,United States,2018,Health Care,Managed Health Care
KERNW,Akerna Corp Warrant,0,United States,2018,Health Care,Managed Health Care
KEX,Kirby Corporation Common Stock,3267633960,United States,,Transportation,Marine Transportation
KEY,KeyCorp Common Stock,20865016167,United States,,Finance,Major Banks
KEY^I,KeyCorp Depositary Shares Each Representing a 1/40th Ownership Interest in a Share of Fixed-to-Floating Rate Perpetual Non-Cumulative Preferred Stock Series E,,United States,,,
KEY^J,KeyCorp Depositary Shares each representing a 1/40th ownership interest in a share of Fixed Rate Perpetual Non-Cumulative Preferred Stock Series F,,United States,,,
