Symbol,Name,Market Cap,Country,IPO Year,Sector,Industry
A,Agilent Technologies Inc. Common Stock,45205576012,United States,1999,Capital Goods,Electrical Products
AA,Alcoa Corporation Common Stock ,8245635688,,2016,Basic Industries,Metal Fabrications
AAC,Ares Acquisition Corporation Class A Ordinary Shares,1223750000,,2021,Finance,Business Services
AACG,ATA Creativity Global American Depositary Shares,41417534,China,,Miscellaneous,Service to the Health Industry
AACI,Armada Acquisition Corp. I Common Stock,202538910,United States,2021,,
AACIU,Armada Acquisition Corp. I Unit,0,United States,2021,,
AACIW,Armada Acquisition Corp. I Warrant,0,United States,2021,,
AADI,Aadi Bioscience Inc. Common Stock,403672640,United States,,Health Care,Biotechnology: Pharmaceutical Preparations
AAIC,Arlington Asset Investment Corp Class A (new),114899879,United States,,Consumer Services,Real Estate Investment Trusts
AAIC^B,Arlington Asset Investment Corp 7.00% ,,United States,,,
AAIC^C,Arlington Asset Investment Corp 8.250% Seies C Fixed-to-Floating Rate Cumulative Redeemable Preferred Stock   ,,United States,,,
AAIN,Arlington Asset Investment Corp 6.000% Senior Notes Due 2026,0,United States,,,
AAL,American Airlines Group Inc. Common Stock,10761691356,United States,,Transportation,Air Freight/Delivery Services
AAME,Atlantic American Corporation Common Stock,76623446,United States,,Finance,Life Insurance
AAN,Aarons Holdings Company Inc. Common Stock ,718132864,United States,2020,Miscellaneous,Diversified Commercial Services
AAOI,Applied Optoelectronics Inc. Common Stock,147407294,United States,2013,Technology,Semiconductors
AAON,AAON Inc. Common Stock,4169076946,United States,,Capital Goods,Industrial Machinery/Components
AAP,Advance Auto Parts Inc.,14145895454,United States,,Consumer Services,Other Specialty Stores
AAPL,Apple Inc. Common Stock,2.80588E+12,United States,1980,Technology,Computer Manufacturing
AAQC,Accelerate Acquisition Corp. Class A Common Stock,486500000,,2021,,
AAT,American Assets Trust Inc. Common Stock,2117126996,United States,2011,Consumer Services,Real Estate Investment Trusts
AATC,Autoscope Technologies Corporation Common Stock,34973139,United States,,Capital Goods,Industrial Machinery/Components
AAU,Almaden Minerals Ltd. Common Shares,43361965,Canada,2015,,
AAWW,Atlas Air Worldwide Holdings NEW Common Stock,2523719620,United States,,Transportation,Transportation Services
AB,AllianceBernstein Holding L.P.  Units,5015723177,United States,,Finance,Investment Managers
ABB,ABB Ltd Common Stock,70592060000,Switzerland,,Consumer Durables,Electrical Products
ABBV,AbbVie Inc. Common Stock,2.10113E+11,United States,2012,Health Care,Other Pharmaceuticals
ABC,AmerisourceBergen Corporation Common Stock,24301651230,United States,,Health Care,Other Pharmaceuticals
ABCB,Ameris Bancorp Common Stock,3396108265,United States,1994,Finance,Major Banks
ABCL,AbCellera Biologics Inc. Common Shares,3947769476,Canada,2020,,
ABCM,Abcam plc American Depositary Shares,5048543506,United Kingdom,2020,Health Care,Biotechnology: Biological Products (No Diagnostic Substances)
ABEO,Abeona Therapeutics Inc. Common Stock,58602801,United States,,Health Care,Biotechnology: Pharmaceutical Preparations
ABEV,Ambev S.A. American Depositary Shares (Each representing 1 Common Share),44380713459,,2013,Consumer Non-Durables,Beverages (Production/Distribution)
ABG,Asbury Automotive Group Inc Common Stock,3859960855,United States,2002,Consumer Services,Other Specialty Stores
ABGI,ABG Acquisition Corp. I Class A Ordinary Shares,189072339,United States,2021,Finance,Business Services
ABIO,ARCA biopharma Inc. Common Stock,32422822,United States,,Health Care,Biotechnology: In Vitro & In Vivo Diagnostic Substances
ABM,ABM Industries Incorporated Common Stock,3007696013,United States,,Technology,Diversified Commercial Services
ABMD,ABIOMED Inc. Common Stock,13677910419,United States,,Health Care,Medical/Dental Instruments
ABNB,Airbnb Inc. Class A Common Stock,99449534417,United States,2020,Capital Goods,Industrial Machinery/Components
ABOS,Acumen Pharmaceuticals Inc. Common Stock,316073223,United States,2021,Health Care,Biotechnology: Pharmaceutical Preparations
ABR,Arbor Realty Trust Common Stock,2621809085,United States,2004,Consumer Services,Real Estate Investment Trusts
ABR^D,Arbor Realty Trust 6.375% Series D Cumulative Redeemable Preferred Stock Liquidation Preference $25.00 per Share,,United States,,,
ABR^E,Arbor Realty Trust 6.25% Series E Cumulative Redeemable Preferred Stock,,United States,,,
ABR^F,Arbor Realty Trust 6.25% Series F Fixed-to-Floating Rate Cumulative Redeemable Preferred Stock Liquidation Preference $25.00 per share,,United States,,,
ABSI,Absci Corporation Common Stock,912951914,United States,2021,Health Care,Biotechnology: Pharmaceutical Preparations
ABST,Absolute Software Corporation Common Stock,422976648,Canada,2020,,
ABT,Abbott Laboratories Common Stock,2.30355E+11,United States,,Health Care,Medical/Dental Instruments
ABTX,Allegiance Bancshares Inc. Common Stock,820225415,United States,2015,Finance,Major Banks
ABUS,Arbutus Biopharma Corporation Common Stock,566197975,Canada,,,
ABVC,ABVC BioPharma Inc. Common Stock,83825507,United States,,Health Care,Biotechnology: Pharmaceutical Preparations
AC,Associated Capital Group Inc. Common Stock,795635198,United States,2015,Finance,Investment Bankers/Brokers/Service
ACA,Arcosa Inc. Common Stock ,2585154530,,2018,Capital Goods,Engineering & Construction
ACAD,ACADIA Pharmaceuticals Inc. Common Stock,3020604695,United States,1985,Health Care,Biotechnology: Pharmaceutical Preparations
ACAH,Atlantic Coastal Acquisition Corp. Class A Common Stock,426075000,United States,2021,,
ACAHU,Atlantic Coastal Acquisition Corp. Unit,0,United States,2021,,
ACAHW,Atlantic Coastal Acquisition Corp. Warrant,0,United States,2021,,
ACB,Aurora Cannabis Inc. Common Shares,1153687117,Canada,,,
ACBA,Ace Global Business Acquisition Limited Ordinary Shares,61147822,Hong Kong,2021,Miscellaneous,Business Services
ACBAW,Ace Global Business Acquisition Limited Warrant,0,Hong Kong,2021,Finance,Business Services
ACBI,Atlantic Capital Bancshares Inc. Common Stock,566298697,United States,,Finance,Major Banks
ACC,American Campus Communities Inc Common Stock,7259803526,United States,2004,Consumer Services,Real Estate Investment Trusts
ACCD,Accolade Inc. Common Stock,1604606957,United States,2020,,
ACCO,Acco Brands Corporation Common Stock,797438089,United States,,Consumer Services,Advertising
ACEL,Accel Entertainment Inc. ,1219110640,United States,2017,Consumer Services,Recreational Products/Toys
ACER,Acer Therapeutics Inc. Common Stock (DE),26903259,United States,,Health Care,Biotechnology: Biological Products (No Diagnostic Substances)
ACET,Adicet Bio Inc. Common Stock ,191980314,United States,2018,Health Care,Biotechnology: Pharmaceutical Preparations
ACEV,ACE Convergence Acquisition Corp. Class A Ordinary Shares,285487500,United States,2020,Technology,Semiconductors
ACEVU,ACE Convergence Acquisition Corp. Unit,0,United States,2020,Technology,Semiconductors
ACEVW,ACE Convergence Acquisition Corp. Warrant,0,United States,2020,Technology,Semiconductors
ACGL,Arch Capital Group Ltd. Common Stock,16314150642,Bermuda,,Finance,Property-Casualty Insurers
ACGLN,Arch Capital Group Ltd. Depositary Shares each Representing a 1/1000th Interest in a 4.550% Non-Cumulative Preferred Share Series G,0,Bermuda,,Finance,Property-Casualty Insurers
ACGLO,Arch Capital Group Ltd. Depositary Shares Each Representing 1/1000th Interest in a Share of 5.45% Non-Cumulative Preferred Shares Series F,0,Bermuda,,Finance,Property-Casualty Insurers
ACH,Aluminum Corporation of China Limited American Depositary Shares,8041510702,China,2001,Basic Industries,Aluminum
ACHC,Acadia Healthcare Company Inc. Common Stock,5053482263,United States,,Health Care,Hospital/Nursing Management
ACHL,Achilles Therapeutics plc American Depositary Shares,187994154,United Kingdom,2021,Health Care,Biotechnology: Biological Products (No Diagnostic Substances)
ACHR,Archer Aviation Inc. Class A Common Stock,1466704307,United States,2020,Capital Goods,Aerospace
ACHV,Achieve Life Sciences Inc. Common Shares,65891188,United States,,Health Care,Biotechnology: In Vitro & In Vivo Diagnostic Substances
ACI,Albertsons Companies Inc. Class A Common Stock,16676358930,United States,2020,Consumer Services,Food Chains
ACII,Atlas Crest Investment Corp. II Class A Common Stock,420900000,,2021,,
ACIU,AC Immune SA Common Stock,352365372,Switzerland,2016,Health Care,Biotechnology: Pharmaceutical Preparations
ACIW,ACI Worldwide Inc. Common Stock,3495250559,United States,,Technology,EDP Services
ACKIT,Ackrell SPAC Partners I Co. Subunits,0,United States,2021,,
ACKIU,Ackrell SPAC Partners I Co. Units,0,United States,2020,,
ACKIW,Ackrell SPAC Partners I Co. Warrants,0,United States,2021,,
ACLS,Axcelis Technologies Inc. Common Stock,2063998075,United States,2000,Technology,Industrial Machinery/Components
ACM,AECOM Common Stock,9907230339,United States,2007,Consumer Services,Military/Government/Technical
ACMR,ACM Research Inc. Class A Common Stock,1535072323,United States,2017,Technology,Industrial Machinery/Components
ACN,Accenture plc Class A Ordinary Shares (Ireland),2.28288E+11,Ireland,2001,Miscellaneous,Business Services
ACNB,ACNB Corporation Common Stock,250504996,United States,,Finance,Major Banks
ACOR,Acorda Therapeutics Inc. Common Stock,27557515,United States,2006,Health Care,Biotechnology: Biological Products (No Diagnostic Substances)
ACP,Aberdeen Income Credit Strategies Fund Common Shares,181167739,United States,2011,Finance,Investment Managers
ACP^A,Aberdeen Income Credit Strategies Fund 5.250% Series A Perpetual Preferred Stock,,United States,,,
ACQR,Independence Holdings Corp. Class A Ordinary Share,606676575,United States,2021,Finance,Business Services
ACQRU,Independence Holdings Corp. Units,0,United States,2021,Finance,Business Services
ACQRW,Independence Holdings Corp. Warrant,0,United States,2021,Finance,Business Services
ACR,ACRES Commercial Realty Corp. Common Stock,128161069,United States,,Consumer Services,Real Estate Investment Trusts
ACR^C,ACRES Commercial Realty Corp. 8.625% Fixed-to-Floating Series C Cumulative Redeemable Preferred Stock ,,United States,,,
ACR^D,ACRES Commercial Realty Corp. 7.875% Series D Cumulative Redeemable Preferred Stock,,United States,,,
ACRE,Ares Commercial Real Estate Corporation Common Stock,696566987,United States,2012,Consumer Services,Real Estate Investment Trusts
ACRO,Acropolis Infrastructure Acquisition Corp. Class A Common Stock,419175000,,2021,,
ACRS,Aclaris Therapeutics Inc. Common Stock,765341663,United States,2015,Health Care,Biotechnology: Pharmaceutical Preparations
ACRX,AcelRx Pharmaceuticals Inc. Common Stock,68846823,United States,2011,Consumer Durables,Specialty Chemicals
ACST,Acasti Pharma Inc. Class A Common Stock,51817174,Canada,,,
ACT,Enact Holdings Inc. Common Stock,3447329342,United States,2021,Finance,Specialty Insurers
ACTD,ArcLight Clean Transition Corp. II Class A Ordinary Share,390509625,United States,2021,,
ACTDU,ArcLight Clean Transition Corp. II Unit,0,United States,2021,,
ACTDW,ArcLight Clean Transition Corp. II Warrant,0,United States,2021,Finance,Business Services
ACTG,Acacia Research Corporation (Acacia Tech) Common Stock,239032727,United States,,Miscellaneous,Multi-Sector Companies
ACU,Acme United Corporation. Common Stock,119569886,United States,1988,Consumer Durables,Home Furnishings
ACV,Virtus AllianzGI Diversified Income & Convertible Fund Common Shares of Beneficial Interest,340851046,United States,2015,Finance,Finance/Investors Services
ACVA,ACV Auctions Inc. Class A Common Stock,3333973922,United States,2021,Technology,EDP Services
ACXP,Acurx Pharmaceuticals Inc. Common Stock,42395537,United States,2021,Health Care,Biotechnology: Pharmaceutical Preparations
ACY,AeroCentury Corp. Common Stock,139747900,United States,,Technology,Diversified Commercial Services
ADAG,Adagene Inc. American Depositary Shares,423238761,China,2021,Health Care,Biotechnology: Pharmaceutical Preparations
ADALU,Anthemis Digital Acquisitions I Corp Unit,0,United States,2021,,
ADAP,Adaptimmune Therapeutics plc American Depositary Shares,559210535,United Kingdom,2015,Health Care,Biotechnology: Pharmaceutical Preparations
ADBE,Adobe Inc. Common Stock,2.93345E+11,United States,1986,Technology,Computer Software: Prepackaged Software
ADC,Agree Realty Corporation Common Stock,4804335650,United States,,Consumer Services,Real Estate Investment Trusts
ADC^A,Agree Realty Corporation Depositary Shares each representing 1/1000th of a 4.250% Series A Cumulative Redeemable Preferred Stock,,United States,,,
ADCT,ADC Therapeutics SA Common Shares,1646447618,,2020,Health Care,Biotechnology: Pharmaceutical Preparations
ADER,26 Capital Acquisition Corp. Class A Common Stock,337218750,United States,2021,,
ADERU,26 Capital Acquisition Corp. Unit,0,United States,2021,,
ADERW,26 Capital Acquisition Corp. Warrant,0,United States,2021,,
ADES,Advanced Emissions Solutions Inc. Common Stock,121868804,United States,,Basic Industries,Industrial Specialties
ADEX,Adit EdTech Acquisition Corp. Common Stock,342585000,,2021,,
ADGI,Adagio Therapeutics Inc. Common Stock,5098663578,United States,2021,Health Care,Biotechnology: Pharmaceutical Preparations
ADI,Analog Devices Inc. Common Stock,3.88634E+11,United States,,Technology,Semiconductors
ADIL,Adial Pharmaceuticals Inc Common Stock,55447121,United States,2018,Health Care,Biotechnology: Pharmaceutical Preparations
ADILW,Adial Pharmaceuticals Inc Warrant,0,United States,2018,Health Care,Biotechnology: Pharmaceutical Preparations
ADM,Archer-Daniels-Midland Company Common Stock,34981861988,United States,,,
ADMA,ADMA Biologics Inc Common Stock,252599824,United States,,Health Care,Biotechnology: Pharmaceutical Preparations
ADMP,Adamis Pharmaceuticals Corporation Common Stock,101510571,United States,,Health Care,Biotechnology: Pharmaceutical Preparations
ADN,Advent Technologies Holdings Inc. Class A Common Stock,144089366,United States,2018,,
ADNT,Adient plc Ordinary Shares ,4171507777,,2016,Capital Goods,Auto Parts:O.E.M.
ADNWW,Advent Technologies Holdings Inc. Warrant,0,United States,2018,,
ADOC,Edoc Acquisition Corp. Class A Ordinary Share,120282760,United States,2020,Finance,Business Services
ADOCR,Edoc Acquisition Corp. Right,0,United States,2020,Finance,Business Services
ADOCW,Edoc Acquisition Corp. Warrant,0,United States,2020,Finance,Business Services
ADP,Automatic Data Processing Inc. Common Stock,96871977415,United States,,Miscellaneous,Business Services
ADPT,Adaptive Biotechnologies Corporation Common Stock,3579103564,United States,2019,Health Care,Biotechnology: Biological Products (No Diagnostic Substances)
ADRA,Adara Acquisition Corp. Class A Common Stock,140875000,United States,2021,,
ADS,Alliance Data Systems Corporation Common Stock,3519309355,United States,2001,Finance,Diversified Financial Services
ADSK,Autodesk Inc. Common Stock,56945661228,United States,,Technology,Computer Software: Prepackaged Software
ADT,ADT Inc. Common Stock,6741605182,United States,2018,Consumer Services,Diversified Commercial Services
ADTN,ADTRAN Inc. Common Stock,977980979,United States,1994,Capital Goods,Telecommunications Equipment
ADTX,Aditxt Inc. Common Stock,21603007,United States,2020,Consumer Durables,Specialty Chemicals
ADUS,Addus HomeCare Corporation Common Stock,1348733163,United States,2009,Health Care,Medical/Nursing Services
ADV,Advantage Solutions Inc. Class A Common Stock,2373373067,United States,2019,Technology,Advertising
ADVM,Adverum Biotechnologies Inc. Common Stock,172747678,United States,2014,Health Care,Biotechnology: Pharmaceutical Preparations
ADVWW,Advantage Solutions Inc. Warrant,0,United States,2019,Technology,Advertising
ADX,Adams Diversified Equity Fund Inc.,2061773637,United States,,Finance,Investment Managers
ADXN,Addex Therapeutics Ltd American Depositary Shares,39444382,Switzerland,,Health Care,Biotechnology: Pharmaceutical Preparations
ADXS,Advaxis Inc. Common Stock,45293561,United States,,Health Care,Biotechnology: Pharmaceutical Preparations
AE,Adams Resources & Energy Inc. Common Stock,115407527,United States,,Energy,Oilfield Services/Equipment
AEAC,Authentic Equity Acquisition Corp. Class A ordinary share,293538000,United States,2021,Finance,Business Services
AEACU,Authentic Equity Acquisition Corp. Unit,0,United States,2021,Finance,Business Services
AEACW,Authentic Equity Acquisition Corp. Warrant,0,United States,2021,Finance,Business Services
AEAEU,AltEnergy Acquisition Corp. Unit,0,United States,2021,,
AEE,Ameren Corporation Common Stock,21904254421,United States,,Public Utilities,Power Generation
AEF,Aberdeen Emerging Markets Equity Income Fund Inc. Common Stock,401954082,United States,,Finance,Finance/Investors Services
AEFC,Aegon Funding Company LLC 5.10% Subordinated Notes due 2049,0,,2019,,
AEG,AEGON N.V. Common Stock,9002091428,Netherlands,,Finance,Life Insurance
AEHA,Aesther Healthcare Acquisition Corp Class A Common Stock,132117750,United States,2021,,
AEHAW,Aesther Healthcare Acquisition Corp Warrants,0,United States,2021,,
AEHL,Antelope Enterprise Holdings Limited Common Stock (0.024 par),9969879,China,,Capital Goods,Building Products
AEHR,Aehr Test Systems Common Stock,409509942,United States,1997,Capital Goods,Electrical Products
AEI,Alset EHome International Inc. Common Stock,49379521,United States,2020,Consumer Services,Building operators
AEIS,Advanced Energy Industries Inc. Common Stock,3256916642,United States,1995,Consumer Durables,Electrical Products
AEL,American Equity Investment Life Holding Company Common Stock,3168587957,United States,2003,Finance,Life Insurance
AEL^A,American Equity Investment Life Holding Company Depositary Shares each representing a 1/1000th interest in a share of 5.95% Fixed-Rate Reset Non-Cumulative Preferred Stock Series A,,United States,,,
AEL^B,American Equity Investment Life Holding Company Depositary Shares each representing a 1/1000th interest in a share of 6.625% Fixed-Rate Reset Non-Cumulative Preferred Stock Series B,,United States,,,
AEM,Agnico Eagle Mines Limited Common Stock,11866222206,Canada,,,
AEMD,Aethlon Medical Inc. Common Stock,32642274,United States,,Miscellaneous,Diversified Commercial Services
AENZ,Aenza S.A.A. American Depositary Shares,272038371,,2018,Capital Goods,Engineering & Construction
AEO,American Eagle Outfitters Inc. Common Stock,4438122118,United States,,Consumer Services,Clothing/Shoe/Accessory Stores
AEP,American Electric Power Company Inc. Common Stock,40872714230,United States,,Public Utilities,Electric Utilities: Central
AEPPL,American Electric Power Company Inc. Corporate Unit,0,United States,,Public Utilities,Electric Utilities: Central
AEPPZ,American Electric Power Company Inc. Corporate Units,0,United States,,Public Utilities,Electric Utilities: Central
AER,AerCap Holdings N.V. Ordinary Shares,13610368595,Netherlands,2006,Technology,Diversified Commercial Services
AERC,AeroClean Technologies Inc. Common Stock,201022722,United States,2021,Public Utilities,Environmental Services
AERI,Aerie Pharmaceuticals Inc. Common Stock,483993844,United States,2013,Health Care,Biotechnology: Biological Products (No Diagnostic Substances)
AES,The AES Corporation Common Stock,15841120577,United States,,Public Utilities,Electric Utilities: Central
AESC,The AES Corporation Corporate Units,0,United States,,Public Utilities,Electric Utilities: Central
AESE,Allied Esports Entertainment Inc. Common Stock,74761042,United States,2017,Consumer Services,Television Services
AEVA,Aeva Technologies Inc. Common Stock,1943196608,,2020,Capital Goods,Auto Parts:O.E.M.
AEY,ADDvantage Technologies Group Inc. Common Stock,21894901,United States,,Capital Goods,Recreational Products/Toys
AEYE,AudioEye Inc. Common Stock,85498609,United States,,Technology,EDP Services
AEZS,Aeterna Zentaris Inc. Common Stock,48558803,Canada,,,
AFACU,Arena Fortify Acquisition Corp. Unit,0,United States,2021,Consumer Services,Other Pharmaceuticals
AFAQ,AF Acquisition Corp. Class A Common Stock,273000000,United States,2021,,
AFAQU,AF Acquisition Corp. Units,0,United States,2021,,
AFAQW,AF Acquisition Corp. Warrants,0,United States,2021,,
AFB,AllianceBernstein National Municipal Income Fund Inc,422263110,United States,2002,Finance,Trusts Except Educational Religious and Charitable
AFBI,Affinity Bancshares Inc. Common Stock (MD),103089510,United States,2017,Finance,Major Banks
AFCG,AFC Gamma Inc. Common Stock,361741864,United States,2021,Consumer Services,Real Estate Investment Trusts
AFG,American Financial Group Inc. Common Stock,11336269587,United States,,Finance,Property-Casualty Insurers
AFGB,American Financial Group Inc. 5.875% Subordinated Debentures due 2059,0,United States,2019,Finance,Property-Casualty Insurers
AFGC,American Financial Group Inc. 5.125% Subordinated Debentures due 2059,26358765,United States,2019,Finance,Real Estate
AFGD,American Financial Group Inc. 5.625% Subordinated Debentures due 2060,0,United States,2020,,
AFGE,American Financial Group Inc. 4.500% Subordinated Debentures due 2060,0,United States,2020,,
AFI,Armstrong Flooring Inc. Common Stock,41030819,,2016,Capital Goods,Building Products
AFIB,Acutus Medical Inc. Common Stock,87492727,United States,2020,Health Care,Biotechnology: Electromedical & Electrotherapeutic Apparatus
AFIN,American Finance Trust Inc. Class A Common Stock,1016458281,United States,,Consumer Services,Real Estate Investment Trusts
AFINO,American Finance Trust Inc. 7.375% Series C Cumulative Redeemable Preferred Stock,0,United States,,Consumer Services,Real Estate Investment Trusts
AFINP,American Finance Trust Inc. 7.50% Series A Cumulative Redeemable Perpetual Preferred Stock,0,United States,,Consumer Services,Real Estate Investment Trusts
AFL,AFLAC Incorporated Common Stock,35907751727,United States,,Finance,Accident &Health Insurance
AFMD,Affimed N.V.,727168792,Germany,2014,Health Care,Biotechnology: Pharmaceutical Preparations
AFRM,Affirm Holdings Inc. Class A Common Stock,30135034002,United States,2021,Technology,EDP Services
AFT,Apollo Senior Floating Rate Fund Inc. Common Stock,253217972,,2011,Finance,Investment Managers
AFTR,AfterNext HealthTech Acquisition Corp. Class A Ordinary Shares,303128125,,2021,,
AFYA,Afya Limited Class A Common Shares,1377741539,Brazil,2019,Consumer Services,Other Consumer Services
AG,First Majestic Silver Corp. Ordinary Shares (Canada),2784244692,Canada,,,
AGAC,African Gold Acquisition Corporation Class A Ordinary Shares,504562500,,2021,Finance,Business Services
AGBA,AGBA Acquisition Limited Ordinary Share,58826506,Hong Kong,2019,Finance,Business Services
AGBAR,AGBA Acquisition Limited Right,0,Hong Kong,2019,Finance,Business Services
AGBAW,AGBA Acquisition Limited Warrant,0,Hong Kong,2019,Finance,Business Services
AGCB,Altimeter Growth Corp. 2 Class A Ordinary Shares,571206000,,2021,Finance,Business Services
AGCO,AGCO Corporation Common Stock,8477963459,United States,,Capital Goods,Industrial Machinery/Components
AGD,Aberdeen Global Dynamic Dividend Fund,147708580,United States,2006,Finance,Trusts Except Educational Religious and Charitable
AGE,AgeX Therapeutics Inc. Common Stock,23522289,,2018,Health Care,Biotechnology: Pharmaceutical Preparations
AGEN,Agenus Inc. Common Stock,749947046,United States,2000,Health Care,Biotechnology: Biological Products (No Diagnostic Substances)
AGFS,AgroFresh Solutions Inc. Common Stock,88462518,United States,2014,,
AGFY,Agrify Corporation Common Stock,287158190,United States,2021,Consumer Services,Military/Government/Technical
AGGR,Agile Growth Corp. Class A Ordinary Share,378587500,United States,2021,Finance,Business Services
AGGRU,Agile Growth Corp. Units,0,United States,2021,Finance,Business Services
AGGRW,Agile Growth Corp. Warrant.,0,United States,2021,Finance,Business Services
AGI,Alamos Gold Inc. Class A Common Shares,2873119793,Canada,2015,,
AGIL,AgileThought Inc. Class A Common Stock,394106892,United States,2020,Technology,EDP Services
AGILW,AgileThought Inc. Warrant,0,United States,2020,Technology,EDP Services
AGIO,Agios Pharmaceuticals Inc. Common Stock,1858435980,United States,2013,Health Care,Biotechnology: Pharmaceutical Preparations
AGL,agilon health inc. Common Stock,8510830245,,2021,Health Care,Managed Health Care
AGLE,Aeglea BioTherapeutics Inc. Common Stock,295919748,United States,2016,Health Care,Biotechnology: Pharmaceutical Preparations
AGM,Federal Agricultural Mortgage Corporation Common Stock,1305412178,United States,,Finance,Finance Companies
AGM^C,Federal Agricultural Mortgage Corporation Preferred Series C Fixed to Fltg,,United States,,,
AGM^D,Federal Agricultural Mortgage Corporation 5.700% Non-Cumulative Preferred Stock Series D,,United States,,,
AGM^E,Federal Agricultural Mortgage Corporation 5.750% Non-Cumulative Preferred Stock Series E,,United States,,,
AGM^F,Federal Agricultural Mortgage Corporation 5.250% Non-Cumulative Preferred Stock Series F,,United States,,,
AGM^G,Federal Agricultural Mortgage Corporation 4.875% Non-Cumulative Preferred Stock Series G,,United States,,,
AGMH,AGM Group Holdings Inc. Class A Ordinary Shares,251352179,Hong Kong,2018,Technology,EDP Services
AGNC,AGNC Investment Corp. Common Stock,8046845496,United States,2008,Consumer Services,Real Estate Investment Trusts
AGNCM,AGNC Investment Corp. Depositary Shares rep 6.875% Series D Fixed-to-Floating Cumulative Redeemable Preferred Stock,0,United States,,Consumer Services,Real Estate Investment Trusts
AGNCN,AGNC Investment Corp. Depositary Shares Each Representing a 1/1000th Interest in a Share of 7.00% Series C Fixed-To-Floating Rate Cumulative Redeemable Preferred Stock,0,United States,,Consumer Services,Real Estate Investment Trusts
