Symbol,Name,Market Cap,Country,IPO Year,Sector,Industry
QTWO,Q2 Holdings Inc. Common Stock,4088539087,,2014,Technology,EDP Services
QUAD,Quad Graphics Inc Class A Common Stock,197162969,United States,,Consumer Services,Recreational Products/Toys
QUBT,Quantum Computing Inc. Common Stock,129747827,United States,,Technology,Computer Manufacturing
QUIK,QuickLogic Corporation Common Stock,61809190,United States,1999,Technology,Semiconductors
QUMU,Qumu Corporation Common Stock,35741910,United States,,Technology,Retail: Computer Software & Peripheral Equipment
QUOT,Quotient Technology Inc. Common Stock,624127159,,2014,Technology,Advertising
QURE,uniQure N.V. Ordinary Shares,1254254582,Netherlands,2014,Health Care,Biotechnology: Pharmaceutical Preparations
QVCC,QVC Inc. 6.250% Senior Secured Notes due 2068,0,United States,2019,,
QVCD,QVC Inc. 6.375% Senior Secured Notes due 2067,0,United States,2018,,
R,Ryder System Inc. Common Stock,4258949621,United States,,Miscellaneous,Rental/Leasing Companies
RA,Brookfield Real Assets Income Fund Inc. Common Stock,979167321,,2016,Finance,Investment Managers
RAAS,Cloopen Group Holding Limited American Depositary Shares each representing two Class A Ordinary Shares,443799470,,2021,Technology,Computer Software: Prepackaged Software
RACB,Research Alliance Corp. II Class A Common Stock,186686564,United States,2021,,
RACE,Ferrari N.V. Common Shares,64004542227,,2015,Capital Goods,Auto Manufacturing
RAD,Rite Aid Corporation Common Stock,669255156,United States,,Health Care,Medical/Nursing Services
RADA,RADA Electronic Industries Ltd. Ordinary Shares,389191332,Israel,,,
RADI,Radius Global Infrastructure Inc. Class A Common Stock,1221137989,United States,,Consumer Services,Telecommunications Equipment
RAIL,FreightCar America Inc. Common Stock,53582686,United States,2005,Capital Goods,Railroads
RAIN,Rain Therapeutics Inc. Common Stock,330569658,United States,2021,Health Care,Biotechnology: Pharmaceutical Preparations
RAM,Aries I Acquisition Corporation Class A Ordinary Share,179150234,Cayman Islands,2021,Finance,Business Services
RAMMU,Aries I Acquisition Corporation Unit,0,Cayman Islands,2021,Finance,Business Services
RAMMW,Aries I Acquisition Corporation Warrant,0,Cayman Islands,2021,Finance,Business Services
RAMP,LiveRamp Holdings Inc. Common Stock,3048529072,United States,2018,Technology,EDP Services
RAND,Rand Capital Corporation Common Stock,43696427,United States,,Finance,Finance/Investors Services
RANI,Rani Therapeutics Holdings Inc. Class A Common Stock,428930378,United States,2021,Consumer Durables,Specialty Chemicals
RAPT,RAPT Therapeutics Inc. Common Stock,888154503,United States,2019,Health Care,Biotechnology: Pharmaceutical Preparations
RARE,Ultragenyx Pharmaceutical Inc. Common Stock,5181010722,United States,2014,Health Care,Biotechnology: Pharmaceutical Preparations
RAVE,Rave Restaurant Group Inc. Common Stock,19805394,United States,,Consumer Services,Restaurants
RBA,Ritchie Bros. Auctioneers Incorporated Common Stock,7580353433,Canada,,,
RBAC,RedBall Acquisition Corp. Class A Ordinary Shares,718750000,United States,2020,Finance,Business Services
RBB,RBB Bancorp Common Stock,475029006,United States,2017,Finance,Commercial Banks
RBBN,Ribbon Communications Inc. Common Stock,801088184,United States,,Technology,EDP Services
RBCAA,Republic Bancorp Inc. Class A Common Stock,1056878818,United States,1998,Finance,Major Banks
RBCN,Rubicon Technology Inc. Common Stock,23820933,United States,2007,Technology,Semiconductors
RBKB,Rhinebeck Bancorp Inc. Common Stock,119632794,United States,2019,Finance,Major Banks
RBLX,Roblox Corporation Class A Common Stock,65865707817,,2021,Technology,EDP Services
RBNC,Reliant Bancorp Inc. Common Stock,555981847,United States,,Finance,Major Banks
RBOT,Vicarious Surgical Inc. Class A Common Stock,1241975607,Hong Kong,2020,Health Care,Medical Specialities
RC,Ready Capital Corproation Common Stock,1165725285,United States,2013,Consumer Services,Real Estate Investment Trusts
RC^C,Ready Capital Corporation 6.25% Series C Cumulative Convertible Preferred Stock,,United States,,,
RC^E,Ready Capital Corporation 6.50% Series E Cumulative Redeemable Preferred Stock,,United States,,,
RCA,Ready Capital Corporation 7.00% Convertible Senior Notes due 2023,0,United States,2017,Consumer Services,Real Estate Investment Trusts
RCAT,Red Cat Holdings Inc. Common Stock,111117861,United States,,Technology,Retail: Computer Software & Peripheral Equipment
RCB,Ready Capital Corporation 6.20% Senior Notes due 2026,0,United States,2019,,
RCC,Ready Capital Corporation 5.75% Senior Notes due 2026,0,United States,2021,Finance,Finance Companies
RCEL,Avita Therapeutics Inc. Common Stock,321534022,United States,,Health Care,Medical Specialities
RCG,RENN Fund Inc Common Stock,17498751,United States,,Finance,Investment Managers
RCHG,Recharge Acquisition Corp. Class A Common Stock,247744500,United States,2020,,
RCHGU,Recharge Acquisition Corp. Unit,0,United States,2020,,
RCHGW,Recharge Acquisition Corp. Warrant,0,United States,2020,,
RCI,Rogers Communication Inc. Common Stock,23019545248,Canada,,,
RCII,Rent-A-Center Inc. Common Stock,3012687841,United States,1995,Technology,Diversified Commercial Services
RCKT,Rocket Pharmaceuticals Inc. Common Stock,1468646877,United States,2015,Health Care,Biotechnology: Pharmaceutical Preparations
RCKY,Rocky Brands Inc. Common Stock,250761836,United States,1993,Consumer Non-Durables,Shoe Manufacturing
RCL,D/B/A Royal Caribbean Cruises Ltd. Common Stock,17009770186,United States,1993,Transportation,Hotels/Resorts
RCLF,Rosecliff Acquisition Corp I Class A Common Stock,310241250,United States,2021,,
RCLFU,Rosecliff Acquisition Corp I Unit,0,United States,2021,,
RCLFW,Rosecliff Acquisition Corp I Warrants,0,United States,2021,,
RCM,R1 RCM Inc. Common Stock,6679158135,United States,,Consumer Services,Other Consumer Services
RCMT,RCM Technologies Inc. Common Stock,73073592,United States,,Consumer Services,Military/Government/Technical
RCON,Recon Technology Ltd. Class A Ordinary Shares,11812644,China,2009,Energy,Oilfield Services/Equipment
RCOR,Renovacor Inc. Common Stock,144778192,,2020,Health Care,Biotechnology: Pharmaceutical Preparations
RCRT,Recruiter.com Group Inc. Common Stock,41167781,United States,,,
RCRTW,Recruiter.com Group Inc. Warrant,0,United States,,,
RCS,PIMCO Strategic Income Fund Inc.,308115180,United States,1994,Finance,Investment Managers
RCUS,Arcus Biosciences Inc. Common Stock,3105026795,,2018,Health Care,Biotechnology: Pharmaceutical Preparations
RDBX,Redbox Entertainment Inc. Class A Common Stock,119497347,United States,2020,,
RDBXW,Redbox Entertainment Inc. Warrant,0,United States,2020,,
RDCM,Radcom Ltd. Ordinary Shares,153659089,Israel,1997,Technology,Computer peripheral equipment
RDFN,Redfin Corporation Common Stock,4042045255,United States,2017,Finance,Real Estate
RDHL,Redhill Biopharma Ltd. American Depositary Shares,133624088,Israel,,Health Care,Biotechnology: Pharmaceutical Preparations
RDI,Reading International Inc Class A Common Stock,86583338,United States,,Consumer Services,Movies/Entertainment
RDIB,Reading International Inc Class B Common Stock,540873244,United States,,Consumer Services,Movies/Entertainment
RDN,Radian Group Inc. Common Stock,3728335897,United States,,Finance,Property-Casualty Insurers
RDNT,RadNet Inc. Common Stock,1443325213,United States,,Health Care,Medical Specialities
RDS/B,Royal Dutch Shell PLC,,Netherlands,,,
RDUS,Radius Health Inc. Common Stock,706819195,United States,2014,Health Care,Biotechnology: Pharmaceutical Preparations
RDVT,Red Violet Inc. Common Stock ,499702668,United States,,Technology,Computer Software: Prepackaged Software
RDW,Redwire Corporation Common Stock,459988415,United States,2021,Capital Goods,Aerospace
RDWR,Radware Ltd. Ordinary Shares,1347302245,Israel,1999,Miscellaneous,Business Services
RDY,Dr. Reddy's Laboratories Ltd Common Stock,10038361862,India,,Health Care,Biotechnology: Pharmaceutical Preparations
RE,Everest Re Group Ltd. Common Stock,10333188254,Bermuda,,Finance,Property-Casualty Insurers
REAL,The RealReal Inc. Common Stock,1206584877,United States,2019,Consumer Non-Durables,Consumer Specialties
REAX,The Real Brokerage Inc. Common Shares,650284000,Canada,,,
REDU,RISE Education Cayman Ltd American Depositary Shares,32172663,China,2017,Miscellaneous,Service to the Health Industry
REE,REE Automotive Ltd. Class A Ordinary Shares,1256506801,Israel,,,
REEAW,REE Automotive Ltd. Warrant,0,Israel,,,
REED,Reeds Inc. Common Stock,34979786,United States,,Consumer Non-Durables,Beverages (Production/Distribution)
REFR,Research Frontiers Incorporated Common Stock,65199816,United States,,Capital Goods,Industrial Machinery/Components
REG,Regency Centers Corporation Common Stock,12287957225,United States,1993,Consumer Services,Real Estate Investment Trusts
REGI,Renewable Energy Group Inc. Common Stock,2313951207,United States,2012,Basic Industries,Major Chemicals
REGN,Regeneron Pharmaceuticals Inc. Common Stock,68307023313,United States,1991,Health Care,Biotechnology: Pharmaceutical Preparations
REI,Ring Energy Inc. Common Stock,224190365,United States,,Energy,Oil & Gas Production
REKR,Rekor Systems Inc. Common Stock,265182625,United States,,Technology,EDP Services
RELI,Reliance Global Group Inc. Common Stock,22350462,United States,,Finance,Specialty Insurers
RELIW,Reliance Global Group Inc. Series A Warrants,0,United States,,Finance,Specialty Insurers
RELL,Richardson Electronics Ltd. Common Stock,141189821,United States,1983,Technology,Electronic Components
RELX,RELX PLC PLC American Depositary Shares (Each representing One Ordinary Share),60031323391,United Kingdom,2015,Consumer Services,Publishing
RELY,Remitly Global Inc. Common Stock,3364182840,United States,2021,Technology,Computer Software: Prepackaged Software
RENN,Renren Inc. American Depositary Shares each representing fifteen Class A ordinary shares,608890675,China,2011,Technology,EDP Services
RENT,Rent the Runway Inc. Class A Common Stock,762597003,United States,2021,Consumer Non-Durables,Department/Specialty Retail Stores
REPH,Recro Pharma Inc. Common Stock,65260349,United States,2014,Health Care,Biotechnology: Pharmaceutical Preparations
REPL,Replimune Group Inc. Common Stock,1297073436,United States,2018,Health Care,Biotechnology: Pharmaceutical Preparations
REPX,Riley Exploration Permian Inc. Common Stock,321103485,United States,,Energy,Oil & Gas Production
RERE,ATRenew Inc. American Depositary Shares (every three of which representing two Class A ordinary shares),1380335983,,2021,,
RES,RPC Inc. Common Stock,899575068,United States,,Energy,Oilfield Services/Equipment
RESN,Resonant Inc. Common Stock,114993536,United States,2014,Technology,Semiconductors
RETA,Reata Pharmaceuticals Inc. Class A Common Stock,2863672867,United States,2016,Health Care,Biotechnology: Pharmaceutical Preparations
RETO,ReTo Eco-Solutions Inc. Common Shares,19578688,China,2017,Capital Goods,Multi-Sector Companies
REV,Revlon Inc. New Common Stock,591867285,United States,1996,Consumer Non-Durables,Package Goods/Cosmetics
REVE,Alpine Acquisition Corporation Common Stock,135750000,United States,2021,,
REVEU,Alpine Acquisition Corporation Unit,0,United States,2021,,
REVEW,Alpine Acquisition Corporation Warrant,0,United States,2021,,
REVG,REV Group Inc. Common Stock,1027541175,United States,2017,Capital Goods,Industrial Machinery/Components
REVH,Revolution Healthcare Acquisition Corp. SAIL Class A Common Stock,563062500,United States,2021,,
REVHU,Revolution Healthcare Acquisition Corp. SAIL Units,0,United States,2021,,
REVHW,Revolution Healthcare Acquisition Corp. SAIL Warrant.,0,United States,2021,,
REX,REX American Resources Corporation,601034619,United States,,Basic Industries,Automotive Aftermarket
REXR,Rexford Industrial Realty Inc. Common Stock,10834378133,United States,2013,Consumer Services,Real Estate Investment Trusts
REXR^B,Rexford Industrial Realty Inc. 5.875% Series B Cumulative Redeemable Preferred Stock,,United States,,,
REXR^C,Rexford Industrial Realty Inc. 5.625% Series C Cumulative Redeemable Preferred Stock par value $0.01 per share,,United States,,,
REYN,Reynolds Consumer Products Inc. Common Stock,6221495600,United States,2020,Capital Goods,Office Equipment/Supplies/Services
REZI,Resideo Technologies Inc. Common Stock ,3829118232,,2018,Miscellaneous,Diversified Manufacture
RF,Regions Financial Corporation Common Stock,20876889444,United States,,Finance,Major Banks
RF^B,Regions Financial Corporation Depositary Shares Representing 1/40th Perpetual Preferred Series B,,United States,,,
RF^C,Regions Financial Corporation Depositary Shares each Representing a 1/40th Interest in a  Share of 5.700% Fixed-to-Floating Rate Non-Cumulative  Perpetual Preferred Stock Series C,,United States,,,
RF^E,Regions Financial Corporation Depositary Shares Each Representing a 1/40th Interest in a Share of 4.45% Non-Cumulative Perpetual Preferred Stock Series E,,United States,,,
RFI,Cohen & Steers Total Return Realty Fund Inc. Common Stock,418758608,United States,1993,Finance,Investment Managers
RFIL,RF Industries Ltd. Common Stock,65565105,United States,,Capital Goods,Electrical Products
RFL,Rafael Holdings Inc. Class B Common Stock,110744749,United States,2018,Health Care,Biotechnology: Pharmaceutical Preparations
RFM,RiverNorth Flexible Municipal Income Fund Inc. Common Stock,138069903,,2020,Finance,Trusts Except Educational Religious and Charitable
RFMZ,RiverNorth Flexible Municipal Income Fund II Inc. Common Stock,491661954,,2021,Finance,Trusts Except Educational Religious and Charitable
RFP,Resolute Forest Products Inc. Common Stock,928072563,Canada,,Basic Industries,Paper
RGA,Reinsurance Group of America Incorporated Common Stock,6772183127,United States,,Finance,Life Insurance
RGC,Regencell Bioscience Holdings Limited Ordinary Shares,270493810,Hong Kong,2021,,
RGCO,RGC Resources Inc. Common Stock,198021937,United States,,Public Utilities,Oil & Gas Production
RGEN,Repligen Corporation Common Stock,14534248241,United States,1986,Health Care,Medical/Dental Instruments
RGF,The Real Good Food Company Inc. Class A Common Stock,209842663,United States,2021,Consumer Non-Durables,Food Distributors
RGLD,Royal Gold Inc. Common Stock,6475775130,United States,,,
RGLS,Regulus Therapeutics Inc. Common Stock,29596263,United States,2012,Health Care,Biotechnology: Pharmaceutical Preparations
RGNX,REGENXBIO Inc. Common Stock,1308310073,United States,2015,Health Care,Biotechnology: Biological Products (No Diagnostic Substances)
RGP,Resources Connection Inc. Common Stock,564506447,United States,,Miscellaneous,Business Services
RGR,Sturm Ruger & Company Inc. Common Stock,1135156666,United States,,,
RGS,Regis Corporation Common Stock,117054618,United States,1991,,
RGT,Royce Global Value Trust Inc. Common Stock,88660537,,2013,Finance,Trusts Except Educational Religious and Charitable
RH,RH Common Stock,11502078007,United States,2012,Consumer Services,Other Specialty Stores
RHE,Regional Health Properties Inc. Common Stock,9227946,,2017,Health Care,Hospital/Nursing Management
RHE^A,Regional Health Properties Inc. 10.875% Series A Cumulative Redeemable Preferred Stock,,,,,
RHI,Robert Half International Inc. Common Stock,11984696461,United States,,Technology,Diversified Commercial Services
RHP,Ryman Hospitality Properties Inc. (REIT),4190563998,United States,,Consumer Services,Real Estate Investment Trusts
RIBT,RiceBran Technologies Common Stock,20165178,United States,,Consumer Non-Durables,Specialty Foods
RICK,RCI Hospitality Holdings Inc. Common Stock,554394456,United States,1995,Consumer Services,Restaurants
RICO,Agrico Acquisition Corp. Class A Ordinary Shares,181849500,Cayman Islands,2021,,
RICOW,Agrico Acquisition Corp. Warrant,0,Cayman Islands,2021,,
RIDE,Lordstown Motors Corp. Class A Common Stock,768923612,United States,2019,Capital Goods,Construction/Ag Equipment/Trucks
RIG,Transocean Ltd (Switzerland) Common Stock,1861633748,Switzerland,,Energy,Oil & Gas Production
RIGL,Rigel Pharmaceuticals Inc. Common Stock,418964849,United States,2000,Health Care,Biotechnology: Pharmaceutical Preparations
RILY,B. Riley Financial Inc. Common Stock,2133056316,United States,,Finance,Investment Managers
RILYK,B. Riley Financial Inc. 5.50% Senior Notes Due 2026,0,United States,,Miscellaneous,Business Services
RILYL,B. Riley Financial Inc. Depositary Shares each representing 1/1000th in a share of 7.375% Series B Cumulative Perpetual Preferred Stock par value $0.0001,0,United States,,Finance,Investment Managers
RILYM,B. Riley Financial Inc. 6.375% Senior Notes due 2025,0,United States,,Miscellaneous,Business Services
RILYN,B. Riley Financial Inc. 6.50% Senior Notes Due 2026,0,United States,,Miscellaneous,Business Services
RILYO,B. Riley Financial Inc. 6.75% Senior Notes due 2024,0,United States,,Miscellaneous,Business Services
RILYP,B. Riley Financial Inc. Depositary Shares each representing a 1/1000th fractional interest in a share of Series A Cumulative Perpetual Preferred Stock,0,United States,,Finance,Investment Managers
RILYT,B. Riley Financial Inc. 6.00% Senior Notes Due 2028,0,United States,,Miscellaneous,Business Services
RILYZ,B. Riley Financial Inc. 5.25% Senior Notes due 2028,0,United States,,Miscellaneous,Business Services
RIO,Rio Tinto Plc Common Stock,99307189518,Australia,2002,Basic Industries,Steel/Iron Ore
RIOT,Riot Blockchain Inc.  Common Stock ,3320468673,United States,,Technology,Retail: Computer Software & Peripheral Equipment
RIV,RiverNorth Opportunities Fund Inc. Common Stock,215292505,,2015,Finance,Finance Companies
RIVN,Rivian Automotive Inc. Class A Common Stock,93284744953,United States,2021,Capital Goods,Auto Manufacturing
RJF,Raymond James Financial Inc. Common Stock,19731735733,United States,,Finance,Investment Bankers/Brokers/Service
RKDA,Arcadia Biosciences Inc. Common Stock,24402659,United States,2015,Basic Industries,Agricultural Chemicals
RKLB,Rocket Lab USA Inc. Common Stock,5839659228,United States,2020,Capital Goods,Aerospace
RKLBW,Rocket Lab USA Inc. Warrant,0,United States,2020,Capital Goods,Aerospace
RKLY,Rockley Photonics Holdings Limited Ordinary Shares,749483048,,,,
RKT,Rocket Companies Inc. Class A Common Stock,2121592622,United States,2020,Finance,Finance: Consumer Services
RKTA,Rocket Internet Growth Opportunities Corp. Class A Ordinary Shares,326073750,,2021,,
RL,Ralph Lauren Corporation Common Stock,8552091188,United States,1997,Consumer Non-Durables,Apparel
RLAY,Relay Therapeutics Inc. Common Stock,3044683950,United States,2020,Health Care,Biotechnology: Pharmaceutical Preparations
RLGT,Radiant Logistics Inc. Common Stock,378410028,United States,,Transportation,Oil Refining/Marketing
RLGY,Realogy Holdings Corp. Common Stock,1804785444,United States,2012,Finance,Real Estate
RLI,RLI Corp. Common Stock (DE),4715834756,United States,,Finance,Property-Casualty Insurers
RLJ,RLJ Lodging Trust Common Shares of Beneficial Interest $0.01 par value,2075584084,United States,2011,Consumer Services,Real Estate Investment Trusts
RLJ^A,RLJ Lodging Trust $1.95 Series A Cumulative Convertible  Preferred Shares,,United States,,,
RLMD,Relmada Therapeutics Inc. Common Stock,296796952,United States,,Health Care,Biotechnology: Pharmaceutical Preparations
RLX,RLX Technology Inc. American Depositary Shares each representing the right to receive one (1) Class A ordinary share,5796217203,,2021,Consumer Non-Durables,Farming/Seeds/Milling
RLYB,Rallybio Corporation Common Stock,381704044,United States,2021,Health Care,Biotechnology: Pharmaceutical Preparations
RM,Regional Management Corp. Common Stock,544355177,United States,2012,Finance,Finance: Consumer Services
RMAX,RE/MAX Holdings Inc. Class A Common Stock,518110645,,2013,Finance,Real Estate
RMBI,Richmond Mutual Bancorporation Inc. Common Stock,200282763,United States,2019,,
RMBL,RumbleOn Inc. Class B Common Stock,556367140,United States,,Capital Goods,Automotive Aftermarket
RMBS,Rambus Inc. Common Stock,2964878888,United States,1997,Technology,Semiconductors
RMCF,Rocky Mountain Chocolate Factory Inc. Common Stock,52819748,United States,,Consumer Non-Durables,Specialty Foods
RMD,ResMed Inc. Common Stock,37127342119,United States,,Health Care,Medical/Dental Instruments
RMED,Ra Medical Systems Inc. Common Stock,12196642,,2018,Health Care,Medical/Dental Instruments
RMGC,RMG Acquisition Corp. III Class A Ordinary Shares,589260000,United States,2021,Finance,Business Services
RMGCU,RMG Acquisition Corp. III Unit,0,United States,2021,Finance,Business Services
RMGCW,RMG Acquisition Corp. III Warrant,0,United States,2021,Finance,Business Services
RMI,RiverNorth Opportunistic Municipal Income Fund Inc. Common Stock,141932678,,2018,Finance,Finance/Investors Services
RMM,RiverNorth Managed Duration Municipal Income Fund Inc. Common Stock,389857653,,2019,Finance,Trusts Except Educational Religious and Charitable
RMNI,Rimini Street Inc. (DE) Common Stock,521607900,United States,2015,Technology,EDP Services
RMO,Romeo Power Inc. Class A Common Stock,478872439,,2019,Capital Goods,Automotive Aftermarket
RMPL^,RiverNorth Specialty Finance Corporation 5.875% ,,,,,
RMR,The RMR Group Inc. Class A Common Stock,553236969,United States,,Finance,Real Estate
RMT,Royce Micro-Cap Trust Inc. Common Stock,490250338,United States,,Finance,Investment Managers
RMTI,Rockwell Medical Inc. (DE) Common Stock,35819984,United States,1998,Health Care,Biotechnology: Pharmaceutical Preparations
RNA,Avidity Biosciences Inc. Common Stock,1088012326,United States,2020,Health Care,Biotechnology: Pharmaceutical Preparations
RNAZ,TransCode Therapeutics Inc. Common Stock,34842350,United States,2021,Health Care,Biotechnology: Pharmaceutical Preparations
RNDB,Randolph Bancorp Inc. Common Stock,118589577,United States,2016,Finance,Major Banks
RNERU,Mount Rainier Acquisition Corp. Unit,0,United States,2021,,
RNG,RingCentral Inc. Class A Common Stock,18095254572,,2013,Technology,EDP Services
RNGR,Ranger Energy Services Inc. Class A Common Stock,249971632,United States,2017,Energy,Oilfield Services/Equipment
RNLX,Renalytix plc American Depositary Shares,590402413,United Kingdom,2020,Health Care,Medical Specialities
RNP,Cohen & Steers REIT and Preferred and Income Fund Inc. Common Shares,1265898096,United States,2003,Finance,Investment Managers
RNR,RenaissanceRe Holdings Ltd. Common Stock,7456141282,Bermuda,,Finance,Property-Casualty Insurers
RNR^F,RenaissanceRe Holdings Ltd. Depositary Shares each Representing a 1/1000th Interest in a 5.750% Series F Preference Share,,Bermuda,,,
RNR^G,RenaissanceRe Holdings Ltd. Depositary Shares each representing a 1/1000th interest in a share of 4.20% Series G Preference Shares,,Bermuda,,,
RNST,Renasant Corporation Common Stock,2069343748,United States,,Finance,Major Banks
RNW,ReNew Energy Global plc Class A Ordinary Shares,3101654016,United Kingdom,,,
RNWK,RealNetworks Inc. Common Stock,49015600,United States,1997,Technology,EDP Services
RNWWW,ReNew Energy Global plc Warrant,0,United Kingdom,,,
RNXT,RenovoRx Inc. Common Stock,57457568,United States,2021,Health Care,Biotechnology: Pharmaceutical Preparations
ROAD,Construction Partners Inc. Class A Common Stock,1721936911,United States,2018,Capital Goods,Engineering & Construction
ROCAU,ROC Energy Acquisition Corp. Unit,0,United States,2021,,
ROCC,Ranger Oil Corporation Class A Common Stock,562634590,United States,,Energy,Oil & Gas Production
ROCG,Roth CH Acquisition IV Co. Common Stock,146139525,United States,2021,,
ROCGU,Roth CH Acquisition IV Co. Unit,0,United States,2021,,
ROCGW,Roth CH Acquisition IV Co. Warrant,0,United States,2021,,
ROCK,Gibraltar Industries Inc. Common Stock,2255921937,United States,1993,,
ROCLU,Roth CH Acquisition V Co. Unit,0,United States,2021,,
ROCR,Roth CH Acquisition III Co. Common stock,146795190,United States,2021,,
ROCRU,Roth CH Acquisition III Co. Unit,0,United States,2021,,
ROCRW,Roth CH Acquisition III Co. Warrant,0,United States,2021,,
ROG,Rogers Corporation Common Stock,5105014457,United States,,Capital Goods,Industrial Machinery/Components
ROIC,Retail Opportunity Investments Corp. Common Stock (MD),2169840018,United States,,Consumer Services,Real Estate Investment Trusts
ROIV,Roivant Sciences Ltd. Common Shares,6149406738,United Kingdom,,,
ROIVW,Roivant Sciences Ltd. Warrant,0,United Kingdom,,,
ROK,Rockwell Automation Inc. Common Stock,40068261811,United States,,Capital Goods,Industrial Machinery/Components
ROKU,Roku Inc. Class A Common Stock,27618265112,United States,2017,Consumer Services,Television Services
ROL,Rollins Inc. Common Stock,15632386722,United States,,Technology,Industrial Specialties
ROLL,RBC Bearings Incorporated Common Stock,5821972800,United States,2005,Capital Goods,Metal Fabrications
ROLLP,RBC Bearings Incorporated 5.00% Series A Mandatory Convertible Preferred Stock,0,United States,,Capital Goods,Metal Fabrications
RONI,Rice Acquisition Corp. II Class A Ordinary Shares,344334950,,2021,,
ROOT,Root Inc. Class A Common Stock,840825000,United States,2020,Finance,Property-Casualty Insurers
ROP,Roper Technologies Inc. Common Stock,49163347343,United States,1992,Capital Goods,Office Equipment/Supplies/Services
ROSEU,Rose Hill Acquisition Corporation Unit,0,United States,2021,,
ROSS,Ross Acquisition Corp II Class A Ordinary Shares,423056250,,2021,,
ROST,Ross Stores Inc. Common Stock,39157775243,United States,1985,Consumer Services,Clothing/Shoe/Accessory Stores
ROVR,Rover Group Inc. Class A Common Stock,1728208258,United States,2021,Miscellaneous,Other Consumer Services
ROVRW,Rover Group Inc. Warrant,0,United States,2021,Miscellaneous,Other Consumer Services
RPAY,Repay Holdings Corporation Class A Common Stock,1453389581,United States,2018,Technology,EDP Services
RPD,Rapid7 Inc. Common Stock,6454702190,United States,2015,Technology,Computer Software: Prepackaged Software
RPHM,Reneo Pharmaceuticals Inc. Common Stock,148253073,United States,2021,Health Care,Biotechnology: Pharmaceutical Preparations
