Symbol,Name,Market Cap,Country,IPO Year,Sector,Industry
CVGI,Commercial Vehicle Group Inc. Common Stock,280976385,United States,2004,Capital Goods,Auto Parts:O.E.M.
CVGW,Calavo Growers Inc. Common Stock,713521518,United States,,,Farming/Seeds/Milling
CVI,CVR Energy Inc. Common Stock,1599441830,United States,2007,Energy,Integrated oil Companies
CVII,Churchill Capital Corp VII Class A Common Stock,1688775000,,2021,,
CVLG,Covenant Logistics Group Inc. Class A Common Stock,408911102,United States,,Transportation,Trucking Freight/Courier Services
CVLT,Commvault Systems Inc. Common Stock,2871597393,United States,2006,Technology,Computer Software: Prepackaged Software
CVLY,Codorus Valley Bancorp Inc Common Stock,205756797,United States,,Finance,Savings Institutions
CVM,Cel-Sci Corporation Common Stock,367460401,United States,,Health Care,Biotechnology: Biological Products (No Diagnostic Substances)
CVNA,Carvana Co. Class A Common Stock,22368231708,United States,2017,Consumer Services,Other Specialty Stores
CVR,Chicago Rivet & Machine Co. Common Stock,24916448,United States,,Consumer Non-Durables,Industrial Specialties
CVRX,CVRx Inc. Common Stock,229568067,United States,2021,Health Care,Biotechnology: Electromedical & Electrotherapeutic Apparatus
CVS,CVS Health Corporation Common Stock,1.19954E+11,United States,,Health Care,Managed Health Care
CVU,CPI Aerostructures Inc. Common Stock,31273361,United States,,Capital Goods,Military/Government/Technical
CVV,CVD Equipment Corporation Common Stock,28220988,United States,,Technology,Industrial Machinery/Components
CVX,Chevron Corporation Common Stock,2.20547E+11,United States,,Energy,Integrated oil Companies
CW,Curtiss-Wright Corporation Common Stock,5088997471,United States,,Capital Goods,Industrial Machinery/Components
CWAN,Clearwater Analytics Holdings Inc. Class A Common Stock,3779681677,,2021,Technology,Computer Software: Prepackaged Software
CWBC,Community West Bancshares Common Stock,114164465,United States,,Finance,Major Banks
CWBR,CohBar Inc. Common Stock,39060965,United States,,Health Care,Biotechnology: In Vitro & In Vivo Diagnostic Substances
CWCO,Consolidated Water Co. Ltd. Ordinary Shares,168686652,Cayman Islands,,Public Utilities,Water Supply
CWEN,Clearway Energy Inc. Class C Common Stock,4296655196,United States,2015,Public Utilities,Electric Utilities: Central
CWH,Camping World Holdings Inc. Class A Commom Stock,1858720172,United States,2016,Consumer Services,Other Specialty Stores
CWK,Cushman & Wakefield plc Ordinary Shares,4207927314,,2018,Finance,Real Estate
CWST,Casella Waste Systems Inc. Class A Common Stock,4356492191,United States,1997,Public Utilities,Environmental Services
CWT,California Water Service Group Common Stock,3438458880,United States,,Public Utilities,Water Supply
CX,Cemex S.A.B. de C.V. Sponsored ADR,8881569344,Mexico,,Capital Goods,Building Materials
CXDO,Crexendo Inc. Common Stock,107124957,United States,,Consumer Services,Telecommunications Equipment
CXE,MFS High Income Municipal Trust Common Stock,156357393,United States,1989,Finance,Investment Managers
CXH,MFS Investment Grade Municipal Trust Common Stock,89341440,United States,1989,Finance,Investment Managers
CXM,Sprinklr Inc. Class A Common Stock,3346043115,,2021,Technology,Computer Software: Prepackaged Software
CXP,Columbia Property Trust Inc. Common Stock,2209502636,United States,2013,Consumer Services,Real Estate Investment Trusts
CXW,CoreCivic Inc. Common Stock,1232918841,United States,,Consumer Services,Real Estate Investment Trusts
CYAD,Celyad Oncology SA American Depositary Shares,75641593,Belgium,2015,Health Care,Biotechnology: Pharmaceutical Preparations
CYAN,Cyanotech Corporation Common Stock,21493756,United States,,Consumer Non-Durables,Farming/Seeds/Milling
CYBE,CyberOptics Corporation Common Stock,315553052,United States,1987,Capital Goods,Electronic Components
CYBN,Cybin Inc. Common Shares,224298683,,,,
CYBR,CyberArk Software Ltd. Ordinary Shares,6027564759,Israel,2014,Technology,Computer Software: Prepackaged Software
CYCC,Cyclacel Pharmaceuticals Inc. Common Stock,32319437,United States,,Health Care,Biotechnology: Pharmaceutical Preparations
CYCCP,Cyclacel Pharmaceuticals Inc. 6% Convertible Preferred Stock,0,United States,,Health Care,Biotechnology: Pharmaceutical Preparations
CYCN,Cyclerion Therapeutics Inc. Common Stock,76668869,United States,,Health Care,Biotechnology: Pharmaceutical Preparations
CYD,China Yuchai International Limited Common Stock,480084908,Singapore,1994,Capital Goods,Construction/Ag Equipment/Trucks
CYH,Community Health Systems Inc. Common Stock,1543020459,United States,2000,Health Care,Hospital/Nursing Management
CYN,Cyngn Inc. Common Stock,140366053,United States,2021,Technology,EDP Services
CYRN,CYREN Ltd. Ordinary Shares,28274816,United States,,Technology,Computer Software: Prepackaged Software
CYRX,CryoPort Inc. Common Stock,3127443542,United States,,,
CYT,Cyteir Therapeutics Inc. Common Stock,485289146,United States,2021,Health Care,Biotechnology: Pharmaceutical Preparations
CYTH,Cyclo Therapeutics Inc. Common Stock,40092923,United States,,Health Care,Biotechnology: Pharmaceutical Preparations
CYTHW,Cyclo Therapeutics Inc. Warrant,0,United States,,Health Care,Biotechnology: Pharmaceutical Preparations
CYTK,Cytokinetics Incorporated Common Stock,2977844832,United States,2004,Health Care,Biotechnology: Pharmaceutical Preparations
CYTO,Altamira Therapeutics Ltd. Common Shares 0.01 SF (Bermuda),20807137,Bermuda,2014,Health Care,Biotechnology: Pharmaceutical Preparations
CYXT,Cyxtera Technologies Inc. Class A Common Stock,1676385274,United States,2020,Technology,EDP Services
CYXTW,Cyxtera Technologies Inc. Warrant,0,United States,2020,Technology,EDP Services
CZNC,Citizens & Northern Corp Common Stock,396295286,United States,,Finance,Major Banks
CZOO,Cazoo Group Ltd Class A Ordinary Shares,5528323367,,,Consumer Durables,Automotive Aftermarket
CZR,Caesars Entertainment Inc. Common Stock,18510695163,United States,,Consumer Services,Hotels/Resorts
CZWI,Citizens Community Bancorp Inc. Common Stock,144303553,United States,,Finance,Savings Institutions
D,Dominion Energy Inc. Common Stock,59155710120,United States,,Public Utilities,Electric Utilities: Central
DAC,Danaos Corporation Common Stock,1412726281,Greece,2006,Transportation,Marine Transportation
DADA,Dada Nexus Limited American Depositary Shares,3443480615,China,2020,Consumer Services,Department/Specialty Retail Stores
DAIO,Data I/O Corporation Common Stock,39570422,United States,1981,Capital Goods,Industrial Machinery/Components
DAKT,Daktronics Inc. Common Stock,206828987,United States,1994,Capital Goods,Office Equipment/Supplies/Services
DAL,Delta Air Lines Inc. Common Stock,23027697172,United States,,Transportation,Air Freight/Delivery Services
DALN,DallasNews Corporation Series A Common Stock,33988312,United States,,Consumer Services,Newspapers/Magazines
DALS,DA32 Life Science Tech Acquisition Corp. Class A Common Stock,252396000,United States,2021,,
DAN,Dana Incorporated Common Stock ,3235171760,United States,,Capital Goods,Auto Parts:O.E.M.
DAO,Youdao Inc. American Depositary Shares each representing one Class A Ordinary Share,1367509945,,2019,Consumer Services,Other Consumer Services
DAR,Darling Ingredients Inc. Common Stock,10468991381,United States,,Consumer Non-Durables,Farming/Seeds/Milling
DARE,Dare Bioscience Inc. Common Stock,136350891,United States,2014,Health Care,Biotechnology: Pharmaceutical Preparations
DASH,DoorDash Inc. Class A Common Stock,54103500387,,2020,Capital Goods,Industrial Machinery/Components
DATS,DatChat Inc. Common Stock,64279534,United States,2021,Technology,Computer Software: Prepackaged Software
DATSW,DatChat Inc. Series A Warrant,0,United States,2021,Technology,Computer Software: Prepackaged Software
DAVA,Endava plc American Depositary Shares (each representing one Class A Ordinary Share),7840293462,,2018,Technology,EDP Services
DAWN,Day One Biopharmaceuticals Inc. Common Stock,1114720902,United States,2021,Health Care,Biotechnology: Pharmaceutical Preparations
DB,Deutsche Bank AG Common Stock,25328550000,Germany,,Finance,Commercial Banks
DBD,Diebold Nixdorf Incorporated Common Stock,633893997,United States,,Technology,EDP Services
DBDR,Roman DBDR Tech Acquisition Corp. Class A Common Stock,294081200,United States,2020,Finance,Finance: Consumer Services
DBDRW,Roman DBDR Tech Acquisition Corp. Warrant,0,United States,2020,,
DBGI,Digital Brands Group Inc. Common Stock,28831923,United States,2021,Consumer Non-Durables,Apparel
DBGIW,Digital Brands Group Inc. Warrant,0,United States,2021,Consumer Non-Durables,Apparel
DBI,Designer Brands Inc. Class A Common Stock,980385259,United States,,Consumer Services,Clothing/Shoe/Accessory Stores
DBL,DoubleLine Opportunistic Credit Fund Common Shares of Beneficial Interest,285067147,United States,2012,,
DBRG,DigitalBridge Group Inc.,4488725953,United States,2014,Consumer Services,Real Estate Investment Trusts
DBRG^H,DigitalBridge Group Inc. 7.125% Series H ,,United States,,,
DBRG^I,DigitalBridge Group Inc. 7.15% Series I ,,United States,,,
DBRG^J,DigitalBridge Group Inc. 7.125% Series J ,,United States,,,
DBTX,Decibel Therapeutics Inc. Common Stock,154524851,United States,2021,Health Care,Biotechnology: Pharmaceutical Preparations
DBVT,DBV Technologies S.A. American Depositary Shares,298711417,France,2014,Health Care,Biotechnology: Pharmaceutical Preparations
DBX,Dropbox Inc. Class A Common Stock,9163981583,United States,2018,Technology,Computer Software: Prepackaged Software
DCBO,Docebo Inc. Common Shares,2060491747,Canada,,,
DCF,BNY Mellon Alcentra Global Credit Income 2024 Target Term Fund Inc. Common Stock,141859161,,2017,Finance,Finance/Investors Services
DCGO,DocGo Inc. Common Stock,802556893,United States,2020,Health Care,Managed Health Care
DCGOW,DocGo Inc. Warrants,0,United States,2020,Health Care,Managed Health Care
DCI,Donaldson Company Inc. Common Stock,6889191654,United States,,Capital Goods,Pollution Control Equipment
DCO,Ducommun Incorporated Common Stock,525216475,United States,,Capital Goods,Military/Government/Technical
DCOM,Dime Community Bancshares Inc. Common Stock,1390419034,United States,,Finance,Savings Institutions
DCOMP,Dime Community Bancshares Inc. Fixed-Rate Non-Cumulative Perpetual Preferred Stock Series A,0,United States,,Finance,Savings Institutions
DCP,DCP Midstream  LP Common Units ,5423966682,United States,,Public Utilities,Natural Gas Distribution
DCP^B,DCP Midstream LP 7.875% Series B Fixed-to-Floating Rate Cumulative Redeemable Perpetual Preferred Units,,United States,,,
DCP^C,DCP Midstream LP 7.95% Series C Fixed-to-Floating Rate Cumulative Redeemable Perpetual Preferred Units,,United States,,,
DCPH,Deciphera Pharmaceuticals Inc. Common Stock,467846696,United States,2017,Health Care,Biotechnology: Pharmaceutical Preparations
DCRC,Decarbonization Plus Acquisition Corporation III Class A Common Stock,477312500,United States,2021,,
DCRCU,Decarbonization Plus Acquisition Corporation III Unit,0,United States,2021,,
DCRCW,Decarbonization Plus Acquisition Corporation III Warrant,0,United States,2021,,
DCRD,Decarbonization Plus Acquisition Corporation IV Class A Ordinary Share,391754688,United States,2021,,
DCRDU,Decarbonization Plus Acquisition Corporation IV Unit,0,United States,2021,,
DCRDW,Decarbonization Plus Acquisition Corporation IV Warrant,0,United States,2021,,
DCRN,Decarbonization Plus Acquisition Corporation II Class A Common stock,503125000,United States,2021,,
DCRNU,Decarbonization Plus Acquisition Corporation II Unit,0,United States,2021,,
DCRNW,Decarbonization Plus Acquisition Corporation II Warrant,0,United States,2021,,
DCT,Duck Creek Technologies Inc. Common Stock,3677497197,United States,2020,Technology,Retail: Computer Software & Peripheral Equipment
DCTH,Delcath Systems Inc. Common Stock,58188246,United States,,Health Care,Medical Specialities
DCUE,Dominion Energy Inc. 2019 Series A Corporate Units,0,United States,2019,Public Utilities,Electric Utilities: Central
DD,DuPont de Nemours Inc. Common Stock,39106477994,,2017,Capital Goods,Wholesale Distributors
DDD,3D Systems Corporation Common Stock,2711694079,United States,,Technology,Computer peripheral equipment
DDF,Delaware Investments Dividend & Income Fund Inc. Common Stock,82200506,United States,1993,Finance,Finance/Investors Services
DDI,DoubleDown Interactive Co. Ltd. American Depository Shares,768078320,South Korea,2021,Technology,EDP Services
DDL,Dingdong (Cayman) Limited American Depositary Shares (each two representing three Ordinary Shares),3920812641,,2021,,
DDOG,Datadog Inc. Class A Common Stock,51239327953,United States,2019,Technology,EDP Services
DDS,Dillard's Inc. Common Stock,5169390333,United States,,Consumer Services,Department/Specialty Retail Stores
DDT,Dillard's Capital Trust I,0,United States,,Consumer Services,Department/Specialty Retail Stores
DE,Deere & Company Common Stock,1.08286E+11,United States,,Capital Goods,Industrial Machinery/Components
DEA,Easterly Government Properties Inc. Common Stock,1837324351,United States,2015,Consumer Services,Real Estate Investment Trusts
DECK,Deckers Outdoor Corporation Common Stock,10707511612,United States,1993,Consumer Non-Durables,Shoe Manufacturing
DEI,Douglas Emmett Inc. Common Stock,5736630148,United States,2006,Consumer Services,Real Estate Investment Trusts
DELL,Dell Technologies Inc. Class C Common Stock ,44841891832,,2018,Technology,Computer Manufacturing
DEN,Denbury Inc. Common Stock,3853912643,,2020,Energy,Oil & Gas Production
DENN,Denny's Corporation Common Stock,903885230,United States,,Consumer Services,Restaurants
DEO,Diageo plc Common Stock,1.19241E+11,United Kingdom,,Consumer Non-Durables,Beverages (Production/Distribution)
DERM,Journey Medical Corporation Common Stock,110978397,United States,2021,Health Care,Biotechnology: Pharmaceutical Preparations
DESP,Despegar.com Corp. Ordinary Shares,585329389,,2017,Transportation,Other Consumer Services
DEX,Delaware Enhanced Global Dividend Common Shares of Beneficial Interest,110554411,United States,2007,Finance,Finance Companies
DFFN,Diffusion Pharmaceuticals Inc. Common Stock,35661923,United States,,Health Care,Biotechnology: Pharmaceutical Preparations
DFH,Dream Finders Homes Inc. Class A Common Stock,1578416483,United States,2021,,
DFIN,Donnelley Financial Solutions Inc. Common Stock ,1475564202,,2016,Finance,Investment Managers
DFP,Flaherty & Crumrine Dynamic Preferred and Income Fund Inc. Common Stock,534302817,,2013,Finance,Investment Managers
DFS,Discover Financial Services Common Stock,32057650000,United States,,Finance,Finance: Consumer Services
DG,Dollar General Corporation Common Stock,51794868396,United States,2009,Consumer Services,Department/Specialty Retail Stores
DGHI,Digihost Technology Inc. Common Subordinate Voting Shares,114885910,Canada,,,
DGICA,Donegal Group Inc. Class A Common Stock,431405108,United States,,Finance,Property-Casualty Insurers
DGICB,Donegal Group Inc. Class B Common Stock,417933489,United States,1986,Finance,Property-Casualty Insurers
DGII,Digi International Inc. Common Stock,764483566,United States,1989,Technology,Computer peripheral equipment
DGLY,Digital Ally Inc. Common Stock,53229976,United States,,Miscellaneous,Diversified Manufacture
DGNS,Dragoneer Growth Opportunities Corp. II Class A Ordinary Shares,334894000,United States,2020,Finance,Business Services
DGNU,Dragoneer Growth Opportunities Corp. III Class A Ordinary Shares,538345080,United States,2021,Finance,Business Services
DGX,Quest Diagnostics Incorporated Common Stock,19267299533,United States,,Health Care,Medical Specialities
DH,Definitive Healthcare Corp. Class A Common Stock,2856798724,United States,2021,Technology,Computer Software: Prepackaged Software
DHBC,DHB Capital Corp. Class A common stock,350750000,United States,2021,,
DHBCU,DHB Capital Corp. Unit,355781250,United States,2021,,
DHBCW,DHB Capital Corp. Warrant,0,United States,2021,,
DHC,Diversified Healthcare Trust Common Shares of Beneficial Interest,638116367,United States,,Consumer Services,Real Estate Investment Trusts
DHCA,DHC Acquisition Corp. Class A ordinary share,377916692,United States,2021,Finance,Business Services
DHCAU,DHC Acquisition Corp. Unit,0,United States,2021,Finance,Business Services
DHCAW,DHC Acquisition Corp. Warrant,0,United States,2021,Finance,Business Services
DHCNI,Diversified Healthcare Trust 5.625% Senior Notes due 2042,0,United States,,Consumer Services,Real Estate Investment Trusts
DHCNL,Diversified Healthcare Trust 6.25% Senior Notes Due 2046,0,United States,,Consumer Services,Real Estate Investment Trusts
DHF,BNY Mellon High Yield Strategies Fund Common Stock,225460278,United States,1998,Finance,Finance Companies
DHHC,DiamondHead Holdings Corp. Class A Common Stock,421331250,United States,2021,,
DHHCU,DiamondHead Holdings Corp. Unit,0,United States,2021,,
DHHCW,DiamondHead Holdings Corp. Warrant,0,United States,2021,,
DHI,D.R. Horton Inc. Common Stock,36558535648,United States,,,
DHIL,Diamond Hill Investment Group Inc. Class A Common Stock,612486021,United States,,Finance,Investment Managers
DHR,Danaher Corporation Common Stock,2.2362E+11,United States,,Health Care,Medical Specialities
DHR^A,Danaher Corporation 4.75% Mandatory Convertible Preferred Stock Series A,,United States,,,
DHR^B,Danaher Corporation 5.00% Mandatory Convertible Preferred Stock Series B,,United States,,,
DHT,DHT Holdings Inc.,871777618,Jersey,2005,Transportation,Marine Transportation
DHX,DHI Group Inc. Common Stock,264059174,United States,2007,Technology,Diversified Commercial Services
DHY,Credit Suisse High Yield Bond Fund Common Stock,253593135,United States,1998,Finance,Finance/Investors Services
DIAX,Nuveen Dow 30SM Dynamic Overwrite Fund Common Shares of Beneficial Interest,619328528,,2014,Finance,Finance Companies
DIBS,1stdibs.com Inc. Common Stock,489355336,United States,2021,Miscellaneous,Diversified Commercial Services
DICE,DICE Therapeutics Inc. Common Stock,1111769548,United States,2021,Health Care,Biotechnology: Pharmaceutical Preparations
DIDI,DiDi Global Inc. American Depositary Shares (each four representing one Class A Ordinary Share),29277075759,,2021,,
DILA,DILA Capital Acquisition Corp. Class A Common Stock,73975676,Mexico,2021,,
DILAW,DILA Capital Acquisition Corp. Warrant,0,Mexico,2021,,
DIN,Dine Brands Global Inc. Common Stock,1288866342,United States,,Consumer Services,Restaurants
DIOD,Diodes Incorporated Common Stock,4863269153,United States,,Technology,Semiconductors
DIS,Walt Disney Company (The) Common Stock,2.65778E+11,United States,,Consumer Services,Movies/Entertainment
DISA,Disruptive Acquisition Corporation I Class A Ordinary Shares,338250000,United States,2021,Finance,Business Services
DISAU,Disruptive Acquisition Corporation I Unit,0,United States,2021,Finance,Business Services
DISCA,Discovery Inc. Series A Common Stock,12135722701,United States,,Consumer Services,Television Services
DISCB,Discovery Inc. Series B Common Stock,17093208423,United States,,Consumer Services,Television Services
DISCK,Discovery Inc. Series C Common Stock,11736088648,United States,,Consumer Services,Television Services
DISH,DISH Network Corporation Class A Common Stock,16514182811,United States,1995,Consumer Services,Television Services
DIT,AMCON Distributing Company Common Stock,103159481,United States,,Consumer Non-Durables,Food Distributors
DJCO,Daily Journal Corp. (S.C.) Common Stock,481866547,United States,,Consumer Services,Newspapers/Magazines
DK,Delek US Holdings Inc. Common Stock,1182292745,United States,2017,Energy,Integrated oil Companies
DKDCA,Data Knights Acquisition Corp. Class A Common Stock,150649969,United Kingdom,2021,,
DKDCU,Data Knights Acquisition Corp. Unit,0,United Kingdom,2021,,
DKDCW,Data Knights Acquisition Corp. Warrant,0,United Kingdom,2021,,
DKL,Delek Logistics Partners L.P. Common Units representing Limited Partner Interests,1847879359,United States,2012,Energy,Oil & Gas Production
DKNG,DraftKings Inc. Class A Common Stock,11531072177,United States,2019,Consumer Services,Services-Misc. Amusement & Recreation
DKS,Dick's Sporting Goods Inc Common Stock,9601999348,United States,2002,Consumer Services,Other Specialty Stores
DLA,Delta Apparel Inc. Common Stock,198917303,United States,,Consumer Non-Durables,Department/Specialty Retail Stores
DLB,Dolby Laboratories Common Stock,8775673896,United States,2005,Technology,EDP Services
DLCA,Deep Lake Capital Acquisition Corp. Class A Ordinary Shares,252798750,United States,2021,Finance,Business Services
DLCAU,Deep Lake Capital Acquisition Corp. Unit,0,United States,2021,Finance,Business Services
DLCAW,Deep Lake Capital Acquisition Corp. Warrant,0,United States,2021,Finance,Business Services
DLHC,DLH Holdings Corp.,164212820,United States,,Miscellaneous,Business Services
DLNG,Dynagas LNG Partners LP Common Units,113350921,Greece,,,
DLNG^A,Dynagas LNG Partners LP 9.00% Series A Cumulative Redeemable Preferred Units,,Greece,,,
DLNG^B,Dynagas LNG Partners LP 8.75% Series B Fixed to Floating Rate Cumulative Redeemable Perpetual Preferred Units liquidation preference $25.00 per Uni,,Greece,,,
DLO,DLocal Limited Class A Common Shares,9532368929,Uruguay,2021,,
DLPN,Dolphin Entertainment Inc. Common Stock,60988677,United States,,,
DLR,Digital Realty Trust Inc. Common Stock,46904390728,United States,2004,Consumer Services,Real Estate Investment Trusts
DLR^J,Digital Realty Trust Inc. 5.250% Series J Cumulative Redeemable Preferred Stock,,United States,,,
DLR^K,Digital Realty Trust Inc. 5.850% Series K Cumulative Redeemable Preferred Stock par value $0.01 per share,,United States,,,
DLR^L,Digital Realty Trust Inc. 5.200% Series L Cumulative Redeemable Preferred Stock,,United States,,,
DLTH,Duluth Holdings Inc. Class B Common Stock,495187943,United States,2015,Consumer Services,Department/Specialty Retail Stores
DLTR,Dollar Tree Inc. Common Stock,30827978325,United States,1995,Consumer Services,Department/Specialty Retail Stores
DLX,Deluxe Corporation Common Stock,1433259852,United States,,Technology,Advertising
DLY,DoubleLine Yield Opportunities Fund Common Shares of Beneficial Interest,902819019,,2020,Finance,Investment Managers
DM,Desktop Metal Inc. Class A Common Stock,1769671566,,2019,Technology,Computer peripheral equipment
DMAC,DiaMedica Therapeutics Inc. Common Stock,90686514,United States,2018,,
DMAQ,Deep Medicine Acquisition Corp. Class A Common Stock,0,United States,2021,,
DMAQR,Deep Medicine Acquisition Corp. Rights,0,United States,2021,,
DMB,BNY Mellon Municipal Bond Infrastructure Fund Inc. Common Stock,258084291,,2013,Finance,Trusts Except Educational Religious and Charitable
DMF,BNY Mellon Municipal Income Inc. Common Stock,182439359,United States,1988,Finance,Finance/Investors Services
DMLP,Dorchester Minerals L.P. Common Units Representing Limited Partnership Interests,626310452,United States,,Energy,Oil & Gas Production
DMO,Western Asset Mortgage Opportunity Fund Inc. Common Stock,176226632,United States,2010,Finance,Trusts Except Educational Religious and Charitable
DMRC,Digimarc Corporation Common Stock,672016474,United States,,Technology,EDP Services
DMS,Digital Media Solutions Inc. Class A Ordinary Shares,267367621,United States,2018,Technology,Advertising
DMTK,DermTech Inc. Common Stock,509649946,United States,2017,Health Care,Managed Health Care
DMYQ,dMY Technology Group Inc. IV Class A Common Stock,407531250,,2021,,
DMYS,dMY Technology Group Inc. VI Class A Common Stock,296743125,,2021,,
DNA,Ginkgo Bioworks Holdings Inc. Class A Common Stock,12860251470,United States,2021,Health Care,Biotechnology: Biological Products (No Diagnostic Substances)
DNAA,Social Capital Suvretta Holdings Corp. I Class A Ordinary Share,315392100,United States,2021,,
DNAB,Social Capital Suvretta Holdings Corp. II Class A Ordinary Shares,315073200,United States,2021,,
DNAC,Social Capital Suvretta Holdings Corp. III Class A ordinary shares,315711000,United States,2021,,
DNAD,Social Capital Suvretta Holdings Corp. IV Class A Ordinary Shares,315392100,United States,2021,Health Care,Biotechnology: Pharmaceutical Preparations
DNAY,Codex DNA Inc. Common Stock,188152218,United States,2021,Health Care,Medical Specialities
DNB,Dun & Bradstreet Holdings Inc. Common Stock,8114978448,United States,2020,Technology,EDP Services
DNLI,Denali Therapeutics Inc. Common Stock,5201328495,United States,2017,Health Care,Biotechnology: Biological Products (No Diagnostic Substances)
DNMR,Danimer Scientific Inc. Common Stock,1116832226,,2020,Consumer Non-Durables,Plastic Products
DNN,Denison Mines Corp Ordinary Shares (Canada),1162601970,Canada,,,
DNOW,NOW Inc. Common Stock,927588592,,2014,Energy,Metal Fabrications
DNP,DNP Select Income Fund Inc. Common Stock,3624579164,United States,1987,Finance,Investment Managers
DNUT,Krispy Kreme Inc. Common Stock,2625836540,United States,2021,Consumer Services,Specialty Foods
DOC,Physicians Realty Trust Common Shares of Beneficial Interest,3987239660,United States,2013,Consumer Services,Real Estate Investment Trusts
DOCN,DigitalOcean Holdings Inc. Common Stock,8930629012,,2021,Technology,Retail: Computer Software & Peripheral Equipment
DOCS,Doximity Inc. Class A Common Stock,11224415643,,2021,Technology,Retail: Computer Software & Peripheral Equipment
DOCU,DocuSign Inc. Common Stock,26574676093,United States,2018,Technology,EDP Services
DOGZ,Dogness (International) Corporation Class A Common Stock,134208381,China,2017,Consumer Durables,Miscellaneous manufacturing industries
DOLE,Dole plc Ordinary Shares,1193524616,,2021,,
DOMA,Doma Holdings Inc. Common Stock,1796738528,,2021,Finance,Real Estate
DOMO,Domo Inc. Class B Common Stock,1551996043,United States,2018,Technology,Computer Software: Prepackaged Software
DOOO,BRP Inc. (Recreational Products) Common Subordinate Voting Shares,6111068150,Canada,,Consumer Non-Durables,Recreational Products/Toys
DOOR,Masonite International Corporation Ordinary Shares (Canada),2614496432,Canada,,,
